[
  {
    "base_url": "https://www.cityofventura.ca.gov/AgendaCenter",
    "medias": [
      {
        "meeting_url": "",
        "agenda_url": "https://www.cityofventura.ca.gov/AgendaCenter/ViewFile/Agenda/_11182025-3529",
        "minutes_url": "",
        "title": "City Council Closed Session/Regular Meeting",
        "date": "2025-11-18"
      },
      {
        "meeting_url": "",
        "agenda_url": "https://www.cityofventura.ca.gov/AgendaCenter/ViewFile/Agenda/_11182025-3531",
        "minutes_url": "",
        "title": "18 DE NOVIEMBRE DE 2025 AGENDA DEL CONCEJO MUNICIPAL",
        "date": "2025-11-18"
      },
      {
        "meeting_url": "https://www.youtube.com/watch?v=3uQyYOUPCSw",
        "agenda_url": "https://www.cityofventura.ca.gov/AgendaCenter/ViewFile/Agenda/_11042025-3522",
        "minutes_url": "https://www.cityofventura.ca.gov/AgendaCenter/ViewFile/Minutes/_11042025-3522",
        "title": "City Council Closed Session/Regular Meeting",
        "date": "2025-11-04"
      },
      {
        "meeting_url": "",
        "agenda_url": "https://www.cityofventura.ca.gov/AgendaCenter/ViewFile/Agenda/_11042025-3525",
        "minutes_url": "",
        "title": "4 DE NOVIEMBRE DE 2025 AGENDA DEL CONCEJO MUNICIPAL",
        "date": "2025-11-04"
      },
      {
        "meeting_url": "https://www.youtube.com/watch?v=u-glN3YX4-0&list=PL_1f7aI4La-fIRN226r62egMt7LRputho&index=182",
        "agenda_url": "https://www.cityofventura.ca.gov/AgendaCenter/ViewFile/Agenda/_10212025-3517",
        "minutes_url": "https://www.cityofventura.ca.gov/AgendaCenter/ViewFile/Minutes/_10212025-3517",
        "title": "City Council Closed Session/Regular Meeting",
        "date": "2025-10-21"
      },
      {
        "meeting_url": "",
        "agenda_url": "https://www.cityofventura.ca.gov/AgendaCenter/ViewFile/Agenda/_10212025-3519",
        "minutes_url": "",
        "title": "21 DE OCTUBRE DE 2025 AGENDA DEL CONCEJO MUNICIPAL",
        "date": "2025-10-21"
      },
      {
        "meeting_url": "https://www.youtube.com/watch?v=_IQCDMrRTmk",
        "agenda_url": "https://www.cityofventura.ca.gov/AgendaCenter/ViewFile/Agenda/_10142025-3510",
        "minutes_url": "https://www.cityofventura.ca.gov/AgendaCenter/ViewFile/Minutes/_10142025-3510",
        "title": "City Council Closed Session/Regular Meeting",
        "date": "2025-10-14"
      },
      {
        "meeting_url": "",
        "agenda_url": "https://www.cityofventura.ca.gov/AgendaCenter/ViewFile/Agenda/_10142025-3514",
        "minutes_url": "",
        "title": "14 DE OCTUBRE DE 2025 AGENDA DEL CONCEJO MUNICIPAL",
        "date": "2025-10-14"
      },
      {
        "meeting_url": "https://www.youtube.com/watch?v=dclpjUTeBSw",
        "agenda_url": "https://www.cityofventura.ca.gov/AgendaCenter/ViewFile/Agenda/_10072025-3504",
        "minutes_url": "https://www.cityofventura.ca.gov/AgendaCenter/ViewFile/Minutes/_10072025-3504",
        "title": "City Council Closed Session/Regular Meeting",
        "date": "2025-10-07"
      },
      {
        "meeting_url": "",
        "agenda_url": "https://www.cityofventura.ca.gov/AgendaCenter/ViewFile/Agenda/_10072025-3506",
        "minutes_url": "",
        "title": "7 DE OCTUBRE DE 2025 AGENDA DEL CONCEJO MUNICIPAL",
        "date": "2025-10-07"
      },
      {
        "meeting_url": "https://www.youtube.com/watch?v=xFHQAOmu4dY&list=PL_1f7aI4La-fIRN226r62egMt7LRputho&index=180",
        "agenda_url": "https://www.cityofventura.ca.gov/AgendaCenter/ViewFile/Agenda/_09232025-3494",
        "minutes_url": "https://www.cityofventura.ca.gov/AgendaCenter/ViewFile/Minutes/_09232025-3494",
        "title": "City Council Closed Session/Regular Meeting",
        "date": "2025-09-23"
      },
      {
        "meeting_url": "",
        "agenda_url": "https://www.cityofventura.ca.gov/AgendaCenter/ViewFile/Agenda/_09232025-3495",
        "minutes_url": "",
        "title": "23 DE SEPTIEMBRE DE 2025 AGENDA DEL CONCEJO MUNICIPAL",
        "date": "2025-09-23"
      },
      {
        "meeting_url": "https://www.youtube.com/watch?v=eb3TXXCiTfA&list=PL_1f7aI4La-fIRN226r62egMt7LRputho&index=179",
        "agenda_url": "https://www.cityofventura.ca.gov/AgendaCenter/ViewFile/Agenda/_09162025-3490",
        "minutes_url": "https://www.cityofventura.ca.gov/AgendaCenter/ViewFile/Minutes/_09162025-3490",
        "title": "City Council Closed Session/Regular Meeting",
        "date": "2025-09-16"
      },
      {
        "meeting_url": "",
        "agenda_url": "https://www.cityofventura.ca.gov/AgendaCenter/ViewFile/Agenda/_09162025-3492",
        "minutes_url": "",
        "title": "16 DE SEPTIEMBRE DE 2025 AGENDA DEL CONCEJO MUNICIPAL",
        "date": "2025-09-16"
      },
      {
        "meeting_url": "https://www.youtube.com/watch?v=wYFuPv6bjtA ",
        "agenda_url": "https://www.cityofventura.ca.gov/AgendaCenter/ViewFile/Agenda/_08262025-3475",
        "minutes_url": "https://www.cityofventura.ca.gov/AgendaCenter/ViewFile/Minutes/_08262025-3475",
        "title": "City Council Closed Session/Regular Meeting",
        "date": "2025-08-26"
      },
      {
        "meeting_url": "",
        "agenda_url": "https://www.cityofventura.ca.gov/AgendaCenter/ViewFile/Agenda/_08262025-3477",
        "minutes_url": "",
        "title": "26 DE AGOSTO DE 2025 AGENDA DEL CONCEJO MUNICIPAL",
        "date": "2025-08-26"
      },
      {
        "meeting_url": "",
        "agenda_url": "https://www.cityofventura.ca.gov/AgendaCenter/ViewFile/Agenda/_08192025-3469",
        "minutes_url": "",
        "title": "City Council Regular Meeting - Notice of Meeting Type Change",
        "date": "2025-08-19"
      },
      {
        "meeting_url": "https://www.youtube.com/watch?v=1m1CaZgUCZI",
        "agenda_url": "https://www.cityofventura.ca.gov/AgendaCenter/ViewFile/Agenda/_08192025-3470",
        "minutes_url": "https://www.cityofventura.ca.gov/AgendaCenter/ViewFile/Minutes/_08192025-3470",
        "title": "City Council Closed Session/Special Meeting",
        "date": "2025-08-19"
      },
      {
        "meeting_url": "",
        "agenda_url": "https://www.cityofventura.ca.gov/AgendaCenter/ViewFile/Agenda/_08192025-3472",
        "minutes_url": "",
        "title": "19 DE AGOSTO DE 2025 AGENDA DEL CONCEJO MUNICIPAL",
        "date": "2025-08-19"
      },
      {
        "meeting_url": "https://www.youtube.com/watch?v=uxv0q_9-F_8&list=PL_1f7aI4La-fIRN226r62egMt7LRputho&index=176",
        "agenda_url": "https://www.cityofventura.ca.gov/AgendaCenter/ViewFile/Agenda/_07092025-3446",
        "minutes_url": "https://www.cityofventura.ca.gov/AgendaCenter/ViewFile/Minutes/_07092025-3446",
        "title": "City Council Closed Session/Special Meeting",
        "date": "2025-07-09"
      },
      {
        "meeting_url": "",
        "agenda_url": "https://www.cityofventura.ca.gov/AgendaCenter/ViewFile/Agenda/_07092025-3447",
        "minutes_url": "",
        "title": "9 DE JULIO DE 2025 AGENDA DEL CONCEJO MUNICIPAL",
        "date": "2025-07-09"
      },
      {
        "meeting_url": "https://www.youtube.com/watch?v=Qw1Lpz-pQ7E",
        "agenda_url": "https://www.cityofventura.ca.gov/AgendaCenter/ViewFile/Agenda/_07082025-3442",
        "minutes_url": "https://www.cityofventura.ca.gov/AgendaCenter/ViewFile/Minutes/_07082025-3442",
        "title": "City Council Closed Session/Regular Meeting",
        "date": "2025-07-08"
      },
      {
        "meeting_url": "",
        "agenda_url": "https://www.cityofventura.ca.gov/AgendaCenter/ViewFile/Agenda/_07082025-3443",
        "minutes_url": "",
        "title": "8 DE JULIO DE 2025 AGENDA DEL CONCEJO MUNICIPAL",
        "date": "2025-07-08"
      },
      {
        "meeting_url": "https://www.youtube.com/watch?v=KZvggWku3GQ",
        "agenda_url": "https://www.cityofventura.ca.gov/AgendaCenter/ViewFile/Agenda/_07012025-3438",
        "minutes_url": "https://www.cityofventura.ca.gov/AgendaCenter/ViewFile/Minutes/_07012025-3438",
        "title": "City Council Closed Session/Regular Meeting",
        "date": "2025-07-01"
      },
      {
        "meeting_url": "",
        "agenda_url": "https://www.cityofventura.ca.gov/AgendaCenter/ViewFile/Agenda/_07012025-3439",
        "minutes_url": "",
        "title": "1 DE JULIO DE 2025 AGENDA DEL CONCEJO MUNICIPAL",
        "date": "2025-07-01"
      },
      {
        "meeting_url": "https://www.youtube.com/watch?v=ARnP-jFb4gg",
        "agenda_url": "https://www.cityofventura.ca.gov/AgendaCenter/ViewFile/Agenda/_06262025-3435",
        "minutes_url": "https://www.cityofventura.ca.gov/AgendaCenter/ViewFile/Minutes/_06262025-3435",
        "title": "City Council Special Meeting",
        "date": "2025-06-26"
      },
      {
        "meeting_url": "",
        "agenda_url": "https://www.cityofventura.ca.gov/AgendaCenter/ViewFile/Agenda/_06262025-3436",
        "minutes_url": "",
        "title": "26 DE JUNIO DE 2025 AGENDA DEL CONCEJO MUNICIPAL",
        "date": "2025-06-26"
      },
      {
        "meeting_url": "https://www.youtube.com/watch?v=kIU7qMv-GgI&t=13209s",
        "agenda_url": "https://www.cityofventura.ca.gov/AgendaCenter/ViewFile/Agenda/_06242025-3432",
        "minutes_url": "https://www.cityofventura.ca.gov/AgendaCenter/ViewFile/Minutes/_06242025-3432",
        "title": "City Council Closed Session/Regular Meeting",
        "date": "2025-06-24"
      },
      {
        "meeting_url": "",
        "agenda_url": "https://www.cityofventura.ca.gov/AgendaCenter/ViewFile/Agenda/_06242025-3433",
        "minutes_url": "",
        "title": "24 DE JUNIO DE 2025 AGENDA DEL CONCEJO MUNICIPAL",
        "date": "2025-06-24"
      },
      {
        "meeting_url": "https://www.youtube.com/watch?v=9M71qYxJmII&list=PL_1f7aI4La-fIRN226r62egMt7LRputho&index=171",
        "agenda_url": "https://www.cityofventura.ca.gov/AgendaCenter/ViewFile/Agenda/_06102025-3420",
        "minutes_url": "https://www.cityofventura.ca.gov/AgendaCenter/ViewFile/Minutes/_06102025-3420",
        "title": "City Council Regular Meeting",
        "date": "2025-06-10"
      },
      {
        "meeting_url": "",
        "agenda_url": "https://www.cityofventura.ca.gov/AgendaCenter/ViewFile/Agenda/_06102025-3421",
        "minutes_url": "",
        "title": "10 DE JUNIO DE 2025 AGENDA DEL CONCEJO MUNICIPAL",
        "date": "2025-06-10"
      },
      {
        "meeting_url": "https://www.youtube.com/watch?v=bHaBnDfFApw&list=PL_1f7aI4La-fIRN226r62egMt7LRputho&index=1",
        "agenda_url": "https://www.cityofventura.ca.gov/AgendaCenter/ViewFile/Agenda/_05272025-3414",
        "minutes_url": "https://www.cityofventura.ca.gov/AgendaCenter/ViewFile/Minutes/_05272025-3414",
        "title": "City Council Closed Session/Regular Meeting",
        "date": "2025-05-27"
      },
      {
        "meeting_url": "",
        "agenda_url": "https://www.cityofventura.ca.gov/AgendaCenter/ViewFile/Agenda/_05272025-3416",
        "minutes_url": "",
        "title": "27 DE MAYO DE 2025 AGENDA DEL CONCEJO MUNICIPAL",
        "date": "2025-05-27"
      },
      {
        "meeting_url": "https://www.youtube.com/watch?v=ppmtrZCg4T0&list=PL_1f7aI4La-fIRN226r62egMt7LRputho&index=2",
        "agenda_url": "https://www.cityofventura.ca.gov/AgendaCenter/ViewFile/Agenda/_05152025-3402",
        "minutes_url": "https://www.cityofventura.ca.gov/AgendaCenter/ViewFile/Minutes/_05152025-3402",
        "title": "City Council Special Meeting - General Plan",
        "date": "2025-05-15"
      },
      {
        "meeting_url": "",
        "agenda_url": "https://www.cityofventura.ca.gov/AgendaCenter/ViewFile/Agenda/_05152025-3407",
        "minutes_url": "",
        "title": "15 DE MAYO DE 2025 AGENDA DEL CONCEJO MUNICIPAL",
        "date": "2025-05-15"
      },
      {
        "meeting_url": "https://www.youtube.com/watch?v=8WkYTTpZlXg&list=PL_1f7aI4La-fIRN226r62egMt7LRputho&index=3",
        "agenda_url": "https://www.cityofventura.ca.gov/AgendaCenter/ViewFile/Agenda/_05142025-3401",
        "minutes_url": "https://www.cityofventura.ca.gov/AgendaCenter/ViewFile/Minutes/_05142025-3401",
        "title": "City Council Special Meeting - General Plan",
        "date": "2025-05-14"
      },
      {
        "meeting_url": "",
        "agenda_url": "https://www.cityofventura.ca.gov/AgendaCenter/ViewFile/Agenda/_05142025-3406",
        "minutes_url": "",
        "title": "14 DE MAYO DE 2025 AGENDA DEL CONCEJO MUNICIPAL",
        "date": "2025-05-14"
      },
      {
        "meeting_url": "",
        "agenda_url": "https://www.cityofventura.ca.gov/AgendaCenter/ViewFile/Agenda/_05132025-3404",
        "minutes_url": "",
        "title": "13 DE MAYO DE 2025 AGENDA DEL CONCEJO MUNICIPAL",
        "date": "2025-05-13"
      },
      {
        "meeting_url": "https://www.youtube.com/watch?v=-7xr_lYIQ-c&list=PL_1f7aI4La-fIRN226r62egMt7LRputho&index=4",
        "agenda_url": "https://www.cityofventura.ca.gov/AgendaCenter/ViewFile/Agenda/_05132025-3400",
        "minutes_url": "https://www.cityofventura.ca.gov/AgendaCenter/ViewFile/Minutes/_05132025-3400",
        "title": "City Council Closed Session/Regular Meeting",
        "date": "2025-05-13"
      },
      {
        "meeting_url": "https://www.youtube.com/watch?v=zowT8p6O4SE&list=PL_1f7aI4La-fIRN226r62egMt7LRputho&index=5",
        "agenda_url": "https://www.cityofventura.ca.gov/AgendaCenter/ViewFile/Agenda/_05062025-3395",
        "minutes_url": "https://www.cityofventura.ca.gov/AgendaCenter/ViewFile/Minutes/_05062025-3395",
        "title": "City Council Closed Session/Regular Meeting",
        "date": "2025-05-06"
      },
      {
        "meeting_url": "",
        "agenda_url": "https://www.cityofventura.ca.gov/AgendaCenter/ViewFile/Agenda/_05062025-3398",
        "minutes_url": "",
        "title": "6 DE MAYO DE 2025 AGENDA DEL CONCEJO MUNICIPAL",
        "date": "2025-05-06"
      },
      {
        "meeting_url": "",
        "agenda_url": "https://www.cityofventura.ca.gov/AgendaCenter/ViewFile/Agenda/_04242025-3390",
        "minutes_url": "https://www.cityofventura.ca.gov/AgendaCenter/ViewFile/Minutes/_04242025-3390",
        "title": "City Council Closed Session Special Meeting",
        "date": "2025-04-24"
      },
      {
        "meeting_url": "https://www.youtube.com/watch?v=iPE034ou97g&list=PL_1f7aI4La-fIRN226r62egMt7LRputho&index=7",
        "agenda_url": "https://www.cityofventura.ca.gov/AgendaCenter/ViewFile/Agenda/_04222025-3386",
        "minutes_url": "https://www.cityofventura.ca.gov/AgendaCenter/ViewFile/Minutes/_04222025-3386",
        "title": "City Council Closed Session/Regular Meeting",
        "date": "2025-04-22"
      },
      {
        "meeting_url": "",
        "agenda_url": "https://www.cityofventura.ca.gov/AgendaCenter/ViewFile/Agenda/_04222025-3387",
        "minutes_url": "",
        "title": "22 DE ABRIL DE 2025 AGENDA DEL CONCEJO MUNICIPAL",
        "date": "2025-04-22"
      },
      {
        "meeting_url": "https://www.youtube.com/watch?v=7v2NRc8AGg4&list=PL_1f7aI4La-fIRN226r62egMt7LRputho&index=8",
        "agenda_url": "https://www.cityofventura.ca.gov/AgendaCenter/ViewFile/Agenda/_04082025-3375",
        "minutes_url": "https://www.cityofventura.ca.gov/AgendaCenter/ViewFile/Minutes/_04082025-3375",
        "title": "City Council Closed Session/Regular Meeting - Supplemental Packet Posted",
        "date": "2025-04-08"
      },
      {
        "meeting_url": "",
        "agenda_url": "https://www.cityofventura.ca.gov/AgendaCenter/ViewFile/Agenda/_04082025-3376",
        "minutes_url": "",
        "title": "8 DE ABRIL DE 2025 AGENDA DEL CONCEJO MUNICIPAL",
        "date": "2025-04-08"
      },
      {
        "meeting_url": "https://www.youtube.com/watch?v=p-0PgfT5hdI&list=PL_1f7aI4La-fIRN226r62egMt7LRputho&index=9",
        "agenda_url": "https://www.cityofventura.ca.gov/AgendaCenter/ViewFile/Agenda/_03252025-3369",
        "minutes_url": "https://www.cityofventura.ca.gov/AgendaCenter/ViewFile/Minutes/_03252025-3369",
        "title": "City Council Closed Session/Regular Meeting - Supplemental Packet Posted",
        "date": "2025-03-25"
      },
      {
        "meeting_url": "",
        "agenda_url": "https://www.cityofventura.ca.gov/AgendaCenter/ViewFile/Agenda/_03252025-3370",
        "minutes_url": "",
        "title": "25 DE MARZO DE 2025 AGENDA DEL CONCEJO MUNICIPAL",
        "date": "2025-03-25"
      },
      {
        "meeting_url": "https://www.youtube.com/watch?v=_n1EsuyoEI8&t=716s",
        "agenda_url": "https://www.cityofventura.ca.gov/AgendaCenter/ViewFile/Agenda/_03182025-3362",
        "minutes_url": "https://www.cityofventura.ca.gov/AgendaCenter/ViewFile/Minutes/_03182025-3362",
        "title": "City Council Closed Session/Regular Meeting - Supplemental Packet Posted",
        "date": "2025-03-18"
      },
      {
        "meeting_url": "",
        "agenda_url": "https://www.cityofventura.ca.gov/AgendaCenter/ViewFile/Agenda/_03182025-3366",
        "minutes_url": "",
        "title": "18 DE MARZO DE 2025 AGENDA DEL CONCEJO MUNICIPAL",
        "date": "2025-03-18"
      },
      {
        "meeting_url": "https://www.youtube.com/watch?v=fPxif-_v43g&list=PL_1f7aI4La-fIRN226r62egMt7LRputho&index=3",
        "agenda_url": "https://www.cityofventura.ca.gov/AgendaCenter/ViewFile/Agenda/_02252025-3352",
        "minutes_url": "https://www.cityofventura.ca.gov/AgendaCenter/ViewFile/Minutes/_02252025-3352",
        "title": "City Council Closed Session/Regular Meeting - Supplemental Packet Posted",
        "date": "2025-02-25"
      },
      {
        "meeting_url": "",
        "agenda_url": "https://www.cityofventura.ca.gov/AgendaCenter/ViewFile/Agenda/_02252025-3353",
        "minutes_url": "",
        "title": "25 DE FEBRERO DE 2025 AGENDA DEL CONCEJO MUNICIPAL",
        "date": "2025-02-25"
      },
      {
        "meeting_url": "https://www.youtube.com/watch?v=P8DJYFnLq9w&list=PL_1f7aI4La-fIRN226r62egMt7LRputho&index=4",
        "agenda_url": "https://www.cityofventura.ca.gov/AgendaCenter/ViewFile/Agenda/_02112025-3343",
        "minutes_url": "https://www.cityofventura.ca.gov/AgendaCenter/ViewFile/Minutes/_02112025-3343",
        "title": "City Council Closed Session/Regular Meeting - Supplemental Packet Posted",
        "date": "2025-02-11"
      },
      {
        "meeting_url": "",
        "agenda_url": "https://www.cityofventura.ca.gov/AgendaCenter/ViewFile/Agenda/_02112025-3344",
        "minutes_url": "",
        "title": "11 DE FEBRERO DE 2025 AGENDA DEL CONCEJO MUNICIPAL",
        "date": "2025-02-11"
      },
      {
        "meeting_url": "https://www.youtube.com/watch?v=WEcAwtZcmmQ&list=PL_1f7aI4La-fIRN226r62egMt7LRputho&index=5",
        "agenda_url": "https://www.cityofventura.ca.gov/AgendaCenter/ViewFile/Agenda/_02012025-3336",
        "minutes_url": "https://www.cityofventura.ca.gov/AgendaCenter/ViewFile/Minutes/_02012025-3336",
        "title": "City Council Strategic Priority Setting Meeting - Supplemental Packet Posted",
        "date": "2025-02-01"
      },
      {
        "meeting_url": "",
        "agenda_url": "https://www.cityofventura.ca.gov/AgendaCenter/ViewFile/Agenda/_02012025-3337",
        "minutes_url": "",
        "title": "1 DE FEBRERO DE 2025 REUNI\u00d3N DE DEFINICI\u00d3N DE PRIORIDADES ESTRAT\u00c9GICAS",
        "date": "2025-02-01"
      },
      {
        "meeting_url": "https://www.youtube.com/watch?v=kR735x3XCjE&list=PL_1f7aI4La-fIRN226r62egMt7LRputho&index=7",
        "agenda_url": "https://www.cityofventura.ca.gov/AgendaCenter/ViewFile/Agenda/_01282025-3332",
        "minutes_url": "https://www.cityofventura.ca.gov/AgendaCenter/ViewFile/Minutes/_01282025-3332",
        "title": "City Council Closed Session/Regular Meeting - Supplemental Packet Posted",
        "date": "2025-01-28"
      },
      {
        "meeting_url": "",
        "agenda_url": "https://www.cityofventura.ca.gov/AgendaCenter/ViewFile/Agenda/_01282025-3334",
        "minutes_url": "",
        "title": "28 DE ENERO DE 2025 AGENDA DEL CONCEJO MUNICIPAL",
        "date": "2025-01-28"
      },
      {
        "meeting_url": "https://www.youtube.com/watch?v=xT3taDU7aog&list=PL_1f7aI4La-fIRN226r62egMt7LRputho&index=10",
        "agenda_url": "https://www.cityofventura.ca.gov/AgendaCenter/ViewFile/Agenda/_01212025-3328",
        "minutes_url": "https://www.cityofventura.ca.gov/AgendaCenter/ViewFile/Minutes/_01212025-3328",
        "title": "City Council Closed Session/Regular Meeting - Supplemental Packet Posted",
        "date": "2025-01-21"
      },
      {
        "meeting_url": "",
        "agenda_url": "https://www.cityofventura.ca.gov/AgendaCenter/ViewFile/Agenda/_01212025-3329",
        "minutes_url": "",
        "title": "21 DE ENERO DE 2025 AGENDA DEL CONCEJO MUNICIPAL",
        "date": "2025-01-21"
      },
      {
        "meeting_url": "https://www.youtube.com/watch?v=LfOU0LP0-0A&list=PL_1f7aI4La-fIRN226r62egMt7LRputho&index=11",
        "agenda_url": "https://www.cityofventura.ca.gov/AgendaCenter/ViewFile/Agenda/_01142025-3323",
        "minutes_url": "https://www.cityofventura.ca.gov/AgendaCenter/ViewFile/Minutes/_01142025-3323",
        "title": "City Council Closed Session/Regular Meeting - Supplemental Packet Posted",
        "date": "2025-01-14"
      },
      {
        "meeting_url": "",
        "agenda_url": "https://www.cityofventura.ca.gov/AgendaCenter/ViewFile/Agenda/_01142025-3325",
        "minutes_url": "",
        "title": "14 DE ENERO DE 2025 AGENDA DEL CONCEJO MUNICIPAL",
        "date": "2025-01-14"
      },
      {
        "meeting_url": "",
        "agenda_url": "https://www.cityofventura.ca.gov/AgendaCenter/ViewFile/Agenda/_09032025-3484",
        "minutes_url": "https://www.cityofventura.ca.gov/AgendaCenter/ViewFile/Minutes/_09032025-3484",
        "title": "Appointments Recommendation Committee Special Meeting",
        "date": "2025-09-03"
      },
      {
        "meeting_url": "",
        "agenda_url": "https://www.cityofventura.ca.gov/AgendaCenter/ViewFile/Agenda/_08152025-3466",
        "minutes_url": "https://www.cityofventura.ca.gov/AgendaCenter/ViewFile/Minutes/_08152025-3466",
        "title": "Appointments Recommendation Committee Special Meeting",
        "date": "2025-08-15"
      },
      {
        "meeting_url": "",
        "agenda_url": "https://www.cityofventura.ca.gov/AgendaCenter/ViewFile/Agenda/_11132025-3528",
        "minutes_url": "",
        "title": "Arts and Culture Commission Regular Meeting (11/13/2025)",
        "date": "2025-11-13"
      },
      {
        "meeting_url": "",
        "agenda_url": "https://www.cityofventura.ca.gov/AgendaCenter/ViewFile/Agenda/_10092025-3505",
        "minutes_url": "https://www.cityofventura.ca.gov/AgendaCenter/ViewFile/Minutes/_10092025-3505",
        "title": "Arts and Culture Commission Regular Meeting (10/09/2025)",
        "date": "2025-10-09"
      },
      {
        "meeting_url": "",
        "agenda_url": "https://www.cityofventura.ca.gov/AgendaCenter/ViewFile/Agenda/_09112025-3488",
        "minutes_url": "https://www.cityofventura.ca.gov/AgendaCenter/ViewFile/Minutes/_09112025-3488",
        "title": "Arts and Culture Commission Regular Meeting (9/11/2025)",
        "date": "2025-09-11"
      },
      {
        "meeting_url": "",
        "agenda_url": "https://www.cityofventura.ca.gov/AgendaCenter/ViewFile/Agenda/_08142025-3471",
        "minutes_url": "",
        "title": "Arts and Culture Commission Supplemental Packet 2 (8/14/2025)",
        "date": "2025-08-14"
      },
      {
        "meeting_url": "",
        "agenda_url": "https://www.cityofventura.ca.gov/AgendaCenter/ViewFile/Agenda/_08142025-3476",
        "minutes_url": "",
        "title": "Arts and Culture Commission Supplemental Packet 3 (8/14/2025)",
        "date": "2025-08-14"
      },
      {
        "meeting_url": "",
        "agenda_url": "https://www.cityofventura.ca.gov/AgendaCenter/ViewFile/Agenda/_08142025-3454",
        "minutes_url": "",
        "title": "Arts and Culture Commission Regular Meeting (08/14/2025)",
        "date": "2025-08-14"
      },
      {
        "meeting_url": "",
        "agenda_url": "https://www.cityofventura.ca.gov/AgendaCenter/ViewFile/Agenda/_08142025-3462",
        "minutes_url": "",
        "title": "Arts and Culture Commission Supplemental Packet 1 (8/14/2025)",
        "date": "2025-08-14"
      },
      {
        "meeting_url": "",
        "agenda_url": "https://www.cityofventura.ca.gov/AgendaCenter/ViewFile/Agenda/_07102025-3463",
        "minutes_url": "",
        "title": "Arts and Culture Commission Supplemental Packet 2 (7/10/2025)",
        "date": "2025-07-10"
      },
      {
        "meeting_url": "",
        "agenda_url": "https://www.cityofventura.ca.gov/AgendaCenter/ViewFile/Agenda/_07102025-3448",
        "minutes_url": "https://www.cityofventura.ca.gov/AgendaCenter/ViewFile/Minutes/_07102025-3448",
        "title": "Arts and Culture Commission Regular Meeting (07/10/2025)",
        "date": "2025-07-10"
      },
      {
        "meeting_url": "",
        "agenda_url": "https://www.cityofventura.ca.gov/AgendaCenter/ViewFile/Agenda/_07102025-3452",
        "minutes_url": "",
        "title": "Arts and Culture Commission Supplemental Packet 1 (7/10/2025)",
        "date": "2025-07-10"
      },
      {
        "meeting_url": "",
        "agenda_url": "https://www.cityofventura.ca.gov/AgendaCenter/ViewFile/Agenda/_06122025-3423",
        "minutes_url": "",
        "title": "Notice of Cancellation for the Arts and Culture Commission Meeting",
        "date": "2025-06-12"
      },
      {
        "meeting_url": "",
        "agenda_url": "https://www.cityofventura.ca.gov/AgendaCenter/ViewFile/Agenda/_05082025-3399",
        "minutes_url": "https://www.cityofventura.ca.gov/AgendaCenter/ViewFile/Minutes/_05082025-3399",
        "title": "Arts and Culture Commission Regular Meeting (05/8/2025)",
        "date": "2025-05-08"
      },
      {
        "meeting_url": "",
        "agenda_url": "https://www.cityofventura.ca.gov/AgendaCenter/ViewFile/Agenda/_04102025-3378",
        "minutes_url": "https://www.cityofventura.ca.gov/AgendaCenter/ViewFile/Minutes/_04102025-3378",
        "title": "Arts and Culture Commission Regular Meeting (04/10/2025)",
        "date": "2025-04-10"
      },
      {
        "meeting_url": "",
        "agenda_url": "https://www.cityofventura.ca.gov/AgendaCenter/ViewFile/Agenda/_03132025-3358",
        "minutes_url": "https://www.cityofventura.ca.gov/AgendaCenter/ViewFile/Minutes/_03132025-3358",
        "title": "Arts and Culture Commission Regular Meeting (03/13/2025)",
        "date": "2025-03-13"
      },
      {
        "meeting_url": "",
        "agenda_url": "https://www.cityofventura.ca.gov/AgendaCenter/ViewFile/Agenda/_03132025-3363",
        "minutes_url": "",
        "title": "Arts and Culture Commission Supplemental Packet for 3-13-2025",
        "date": "2025-03-13"
      },
      {
        "meeting_url": "",
        "agenda_url": "https://www.cityofventura.ca.gov/AgendaCenter/ViewFile/Agenda/_02132025-3339",
        "minutes_url": "https://www.cityofventura.ca.gov/AgendaCenter/ViewFile/Minutes/_02132025-3339",
        "title": "Arts and Culture Commission Regular Meeting (02/13/2025)",
        "date": "2025-02-13"
      },
      {
        "meeting_url": "",
        "agenda_url": "https://www.cityofventura.ca.gov/AgendaCenter/ViewFile/Agenda/_01092025-3319",
        "minutes_url": "https://www.cityofventura.ca.gov/AgendaCenter/ViewFile/Minutes/_01092025-3319",
        "title": "Arts and Culture Commission Regular Meeting (01/09/2025)",
        "date": "2025-01-09"
      },
      {
        "meeting_url": "https://www.youtube.com/watch?v=y3qAcylnFzo",
        "agenda_url": "https://www.cityofventura.ca.gov/AgendaCenter/ViewFile/Agenda/_02062025-3341",
        "minutes_url": "https://www.cityofventura.ca.gov/AgendaCenter/ViewFile/Minutes/_02062025-3341",
        "title": "City Council Streetlighting Ad Hoc Committee Meeting",
        "date": "2025-02-06"
      },
      {
        "meeting_url": "https://www.youtube.com/watch?v=zO2EXoDpwBc",
        "agenda_url": "https://www.cityofventura.ca.gov/AgendaCenter/ViewFile/Agenda/_01292025-3333",
        "minutes_url": "https://www.cityofventura.ca.gov/AgendaCenter/ViewFile/Minutes/_01292025-3333",
        "title": "City Council Streetlighting Ad Hoc Committee Meeting",
        "date": "2025-01-29"
      },
      {
        "meeting_url": "",
        "agenda_url": "https://www.cityofventura.ca.gov/AgendaCenter/ViewFile/Agenda/_10062025-3508",
        "minutes_url": "",
        "title": "City Council Rules Committee Regular Meeting - CANCELLED",
        "date": "2025-10-06"
      },
      {
        "meeting_url": "https://www.youtube.com/watch?v=2P9eZmt6GAk",
        "agenda_url": "https://www.cityofventura.ca.gov/AgendaCenter/ViewFile/Agenda/_07072025-3445",
        "minutes_url": "https://www.cityofventura.ca.gov/AgendaCenter/ViewFile/Minutes/_07072025-3445",
        "title": "City Council Rules Committee Regular Meeting",
        "date": "2025-07-07"
      },
      {
        "meeting_url": "https://www.youtube.com/watch?v=DVhvP19SFVo&t=894s",
        "agenda_url": "https://www.cityofventura.ca.gov/AgendaCenter/ViewFile/Agenda/_06022025-3418",
        "minutes_url": "https://www.cityofventura.ca.gov/AgendaCenter/ViewFile/Minutes/_06022025-3418",
        "title": "City Council Rules Committee Special Meeting",
        "date": "2025-06-02"
      },
      {
        "meeting_url": "https://www.youtube.com/watch?v=xNisCkb62Ok&t=17s",
        "agenda_url": "https://www.cityofventura.ca.gov/AgendaCenter/ViewFile/Agenda/_04142025-3382",
        "minutes_url": "https://www.cityofventura.ca.gov/AgendaCenter/ViewFile/Minutes/_04142025-3382",
        "title": "City Council Rules Committee Regular Meeting",
        "date": "2025-04-14"
      },
      {
        "meeting_url": "https://www.youtube.com/watch?v=lRGIlhPXfaM",
        "agenda_url": "https://www.cityofventura.ca.gov/AgendaCenter/ViewFile/Agenda/_02102025-3347",
        "minutes_url": "https://www.cityofventura.ca.gov/AgendaCenter/ViewFile/Minutes/_02102025-3347",
        "title": "City Council Rules Committee Special Meeting",
        "date": "2025-02-10"
      },
      {
        "meeting_url": "https://www.youtube.com/live/ZdRwqSr8sdM?si=uI5pFQf3ibwzH1rz",
        "agenda_url": "https://www.cityofventura.ca.gov/AgendaCenter/ViewFile/Agenda/_11202025-3534",
        "minutes_url": "",
        "title": "Design Review Committee Special Meeting - 6:00 PM",
        "date": "2025-11-20"
      },
      {
        "meeting_url": "https://www.youtube.com/live/y_74a9Jl864?si=addSrCrUTgvGMbRs",
        "agenda_url": "https://www.cityofventura.ca.gov/AgendaCenter/ViewFile/Agenda/_11052025-3524",
        "minutes_url": "",
        "title": "Design Review Committee Special Meeting- 4:30 P.M.\nRegular Meeting \u2013 5:30 P.M.",
        "date": "2025-11-05"
      },
      {
        "meeting_url": "https://www.youtube.com/live/xxFkCHesrZg?si=udmbcjFpTc0hP92w",
        "agenda_url": "https://www.cityofventura.ca.gov/AgendaCenter/ViewFile/Agenda/_10012025-3502",
        "minutes_url": "https://www.cityofventura.ca.gov/AgendaCenter/ViewFile/Minutes/_10012025-3502",
        "title": "Design Review Committee Meeting",
        "date": "2025-10-01"
      },
      {
        "meeting_url": "https://www.youtube.com/live/3g5rcnLfOWQ?si=O8afQQRotXNuwRaX",
        "agenda_url": "https://www.cityofventura.ca.gov/AgendaCenter/ViewFile/Agenda/_09032025-3481",
        "minutes_url": "https://www.cityofventura.ca.gov/AgendaCenter/ViewFile/Minutes/_09032025-3481",
        "title": "Design Review Committee Meeting",
        "date": "2025-09-03"
      },
      {
        "meeting_url": "",
        "agenda_url": "https://www.cityofventura.ca.gov/AgendaCenter/ViewFile/Agenda/_08062025-3460",
        "minutes_url": "",
        "title": "Design Review Committee Meeting - CANCELLED",
        "date": "2025-08-06"
      },
      {
        "meeting_url": "https://www.youtube.com/playlist?list=PL_1f7aI4La-cAdy7Nzl3ZPIF03PobjY_R",
        "agenda_url": "https://www.cityofventura.ca.gov/AgendaCenter/ViewFile/Agenda/_07162025-3451",
        "minutes_url": "https://www.cityofventura.ca.gov/AgendaCenter/ViewFile/Minutes/_07162025-3451",
        "title": "Design Review Committee - Special Meeting: Objective Design Standards - Second Open House",
        "date": "2025-07-16"
      },
      {
        "meeting_url": "https://www.youtube.com/watch?v=waxm36G_X7c&list=PL_1f7aI4La-cAdy7Nzl3ZPIF03PobjY_R",
        "agenda_url": "https://www.cityofventura.ca.gov/AgendaCenter/ViewFile/Agenda/_07022025-3440",
        "minutes_url": "https://www.cityofventura.ca.gov/AgendaCenter/ViewFile/Minutes/_07022025-3440",
        "title": "Design Review Committee Meeting",
        "date": "2025-07-02"
      },
      {
        "meeting_url": "https://www.youtube.com/live/uqsMaCsATNA?si=fEe4awE6KTqtYQcN",
        "agenda_url": "https://www.cityofventura.ca.gov/AgendaCenter/ViewFile/Agenda/_06042025-3419",
        "minutes_url": "https://www.cityofventura.ca.gov/AgendaCenter/ViewFile/Minutes/_06042025-3419",
        "title": "Design Review Committee Meeting",
        "date": "2025-06-04"
      },
      {
        "meeting_url": "https://www.youtube.com/watch?v=iICk0zajFzA&list=PL_1f7aI4La-cAdy7Nzl3ZPIF03PobjY_R",
        "agenda_url": "https://www.cityofventura.ca.gov/AgendaCenter/ViewFile/Agenda/_05072025-3397",
        "minutes_url": "https://www.cityofventura.ca.gov/AgendaCenter/ViewFile/Minutes/_05072025-3397",
        "title": "Design Review Committee Meeting",
        "date": "2025-05-07"
      },
      {
        "meeting_url": "https://www.youtube.com/watch?v=SvOQ2Ix-Or8&list=PL_1f7aI4La-cAdy7Nzl3ZPIF03PobjY_R&index=4",
        "agenda_url": "https://www.cityofventura.ca.gov/AgendaCenter/ViewFile/Agenda/_04092025-3377",
        "minutes_url": "https://www.cityofventura.ca.gov/AgendaCenter/ViewFile/Minutes/_04092025-3377",
        "title": "Design Review Committee Special Meeting - Objective Design Standards Open House",
        "date": "2025-04-09"
      },
      {
        "meeting_url": "https://www.youtube.com/watch?v=uJTVbJexdX0&list=PL_1f7aI4La-cAdy7Nzl3ZPIF03PobjY_R&index=5",
        "agenda_url": "https://www.cityofventura.ca.gov/AgendaCenter/ViewFile/Agenda/_04022025-3373",
        "minutes_url": "https://www.cityofventura.ca.gov/AgendaCenter/ViewFile/Minutes/_04022025-3373",
        "title": "Design Review Committee Meeting",
        "date": "2025-04-02"
      },
      {
        "meeting_url": "https://www.youtube.com/watch?v=auUcVHgeMQ8&list=PL_1f7aI4La-cAdy7Nzl3ZPIF03PobjY_R&index=6",
        "agenda_url": "https://www.cityofventura.ca.gov/AgendaCenter/ViewFile/Agenda/_03052025-3357",
        "minutes_url": "https://www.cityofventura.ca.gov/AgendaCenter/ViewFile/Minutes/_03052025-3357",
        "title": "Design Review Committee Meeting",
        "date": "2025-03-05"
      },
      {
        "meeting_url": "https://www.youtube.com/watch?v=AaPw-uKr6zo&list=PL_1f7aI4La-cAdy7Nzl3ZPIF03PobjY_R&index=7",
        "agenda_url": "https://www.cityofventura.ca.gov/AgendaCenter/ViewFile/Agenda/_02052025-3340",
        "minutes_url": "https://www.cityofventura.ca.gov/AgendaCenter/ViewFile/Minutes/_02052025-3340",
        "title": "Design Review Committee Meeting",
        "date": "2025-02-05"
      },
      {
        "meeting_url": "https://www.youtube.com/watch?v=-FpR099Twn4&list=PL_1f7aI4La-cAdy7Nzl3ZPIF03PobjY_R&index=8",
        "agenda_url": "https://www.cityofventura.ca.gov/AgendaCenter/ViewFile/Agenda/_01082025-3321",
        "minutes_url": "https://www.cityofventura.ca.gov/AgendaCenter/ViewFile/Minutes/_01082025-3321",
        "title": "Design Review Committee Meeting",
        "date": "2025-01-08"
      },
      {
        "meeting_url": "",
        "agenda_url": "https://www.cityofventura.ca.gov/AgendaCenter/ViewFile/Agenda/_11172025-3530",
        "minutes_url": "",
        "title": "Director's Hearing Agenda",
        "date": "2025-11-17"
      },
      {
        "meeting_url": "",
        "agenda_url": "https://www.cityofventura.ca.gov/AgendaCenter/ViewFile/Agenda/_10132025-3516",
        "minutes_url": "",
        "title": "Director's Hearing Meeting",
        "date": "2025-10-13"
      },
      {
        "meeting_url": "https://www.youtube.com/live/aoeeNEbvj58?si=6d67w_o8bg7Ttbc0",
        "agenda_url": "https://www.cityofventura.ca.gov/AgendaCenter/ViewFile/Agenda/_09152025-3491",
        "minutes_url": "https://www.cityofventura.ca.gov/AgendaCenter/ViewFile/Minutes/_09152025-3491",
        "title": "Director's Hearing Meeting",
        "date": "2025-09-15"
      },
      {
        "meeting_url": "https://www.youtube.com/live/Zv6I_sSjfeU?si=c6I0nV16GMm4yQ3x",
        "agenda_url": "https://www.cityofventura.ca.gov/AgendaCenter/ViewFile/Agenda/_08182025-3473",
        "minutes_url": "https://www.cityofventura.ca.gov/AgendaCenter/ViewFile/Minutes/_08182025-3473",
        "title": "Director's Hearing Meeting",
        "date": "2025-08-18"
      },
      {
        "meeting_url": "",
        "agenda_url": "https://www.cityofventura.ca.gov/AgendaCenter/ViewFile/Agenda/_07142025-3453",
        "minutes_url": "https://www.cityofventura.ca.gov/AgendaCenter/ViewFile/Minutes/_07142025-3453",
        "title": "Director's Hearing Meeting",
        "date": "2025-07-14"
      },
      {
        "meeting_url": "https://www.youtube.com/watch?v=QWtJVlnqZPo",
        "agenda_url": "https://www.cityofventura.ca.gov/AgendaCenter/ViewFile/Agenda/_06162025-3425",
        "minutes_url": "https://www.cityofventura.ca.gov/AgendaCenter/ViewFile/Minutes/_06162025-3425",
        "title": "Director's Hearing Meeting",
        "date": "2025-06-16"
      },
      {
        "meeting_url": "https://www.youtube.com/watch?v=wPaZAbn7gkA&list=PL_1f7aI4La-dtZ6kslzTFhpPimF4hVl21&index=1",
        "agenda_url": "https://www.cityofventura.ca.gov/AgendaCenter/ViewFile/Agenda/_05192025-3412",
        "minutes_url": "https://www.cityofventura.ca.gov/AgendaCenter/ViewFile/Minutes/_05192025-3412",
        "title": "Director's Hearing Meeting",
        "date": "2025-05-19"
      },
      {
        "meeting_url": "https://www.youtube.com/watch?v=bX8WEAhkiVs&list=PL_1f7aI4La-dtZ6kslzTFhpPimF4hVl21&index=1",
        "agenda_url": "https://www.cityofventura.ca.gov/AgendaCenter/ViewFile/Agenda/_04212025-3389",
        "minutes_url": "https://www.cityofventura.ca.gov/AgendaCenter/ViewFile/Minutes/_04212025-3389",
        "title": "Director's Hearing Meeting",
        "date": "2025-04-21"
      },
      {
        "meeting_url": "https://www.youtube.com/watch?v=lBVnchpTHK4&list=PL_1f7aI4La-dtZ6kslzTFhpPimF4hVl21&index=2",
        "agenda_url": "https://www.cityofventura.ca.gov/AgendaCenter/ViewFile/Agenda/_03172025-3365",
        "minutes_url": "https://www.cityofventura.ca.gov/AgendaCenter/ViewFile/Minutes/_03172025-3365",
        "title": "Director's Hearing Meeting",
        "date": "2025-03-17"
      },
      {
        "meeting_url": "https://www.youtube.com/watch?v=Mo_GknEf_Rs&list=PL_1f7aI4La-dtZ6kslzTFhpPimF4hVl21&index=3",
        "agenda_url": "https://www.cityofventura.ca.gov/AgendaCenter/ViewFile/Agenda/_02182025-3349",
        "minutes_url": "https://www.cityofventura.ca.gov/AgendaCenter/ViewFile/Minutes/_02182025-3349",
        "title": "Director's Hearing Meeting",
        "date": "2025-02-18"
      },
      {
        "meeting_url": "",
        "agenda_url": "https://www.cityofventura.ca.gov/AgendaCenter/ViewFile/Agenda/_01292025-3331",
        "minutes_url": "",
        "title": "Director's Hearing Meeting - Cancelled",
        "date": "2025-01-29"
      },
      {
        "meeting_url": "",
        "agenda_url": "https://www.cityofventura.ca.gov/AgendaCenter/ViewFile/Agenda/_10092025-3497",
        "minutes_url": "",
        "title": "Economic Development Subcommittee Regular Meeting - CANCELLED",
        "date": "2025-10-09"
      },
      {
        "meeting_url": "https://www.youtube.com/watch?v=YY83IDOeF2s&list=PL_1f7aI4La-eqjzwetRA_cgU861ULte74&index=1",
        "agenda_url": "https://www.cityofventura.ca.gov/AgendaCenter/ViewFile/Agenda/_09252025-3500",
        "minutes_url": "https://www.cityofventura.ca.gov/AgendaCenter/ViewFile/Minutes/_09252025-3500",
        "title": "Economic Development Subcommittee Special Meeting",
        "date": "2025-09-25"
      },
      {
        "meeting_url": "https://www.youtube.com/watch?v=TJyqhZVtyA8&list=PL_1f7aI4La-eqjzwetRA_cgU861ULte74&index=1",
        "agenda_url": "https://www.cityofventura.ca.gov/AgendaCenter/ViewFile/Agenda/_08282025-3480",
        "minutes_url": "https://www.cityofventura.ca.gov/AgendaCenter/ViewFile/Minutes/_08282025-3480",
        "title": "Economic Development Subcommittee Special Meeting",
        "date": "2025-08-28"
      },
      {
        "meeting_url": "",
        "agenda_url": "https://www.cityofventura.ca.gov/AgendaCenter/ViewFile/Agenda/_06122025-3424",
        "minutes_url": "",
        "title": "Economic Development Subcommittee Regular Meeting - CANCELLED",
        "date": "2025-06-12"
      },
      {
        "meeting_url": "",
        "agenda_url": "https://www.cityofventura.ca.gov/AgendaCenter/ViewFile/Agenda/_04102025-3381",
        "minutes_url": "https://www.cityofventura.ca.gov/AgendaCenter/ViewFile/Minutes/_04102025-3381",
        "title": "Economic Development Subcommittee Regular Meeting",
        "date": "2025-04-10"
      },
      {
        "meeting_url": "https://www.youtube.com/watch?v=yIkE2Nkmksc&list=PL_1f7aI4La-eqjzwetRA_cgU861ULte74&index=2",
        "agenda_url": "https://www.cityofventura.ca.gov/AgendaCenter/ViewFile/Agenda/_03132025-3361",
        "minutes_url": "https://www.cityofventura.ca.gov/AgendaCenter/ViewFile/Minutes/_03132025-3361",
        "title": "Economic Development Subcommittee Regular Meeting",
        "date": "2025-03-13"
      },
      {
        "meeting_url": "https://www.youtube.com/watch?v=loUMIZCoSz8&list=PL_1f7aI4La-eqjzwetRA_cgU861ULte74&index=1",
        "agenda_url": "https://www.cityofventura.ca.gov/AgendaCenter/ViewFile/Agenda/_02132025-3345",
        "minutes_url": "https://www.cityofventura.ca.gov/AgendaCenter/ViewFile/Minutes/_02132025-3345",
        "title": "Economic Development Subcommittee Regular Meeting",
        "date": "2025-02-13"
      },
      {
        "meeting_url": "https://www.youtube.com/watch?v=5VHWdH4yCII&list=PL_1f7aI4La-d5OH_9Eqe1fjScE2_xt2mW&index=1",
        "agenda_url": "https://www.cityofventura.ca.gov/AgendaCenter/ViewFile/Agenda/_05202025-3410",
        "minutes_url": "https://www.cityofventura.ca.gov/AgendaCenter/ViewFile/Minutes/_05202025-3410",
        "title": "Finance, Audit & Budget Committee Special Meeting",
        "date": "2025-05-20"
      },
      {
        "meeting_url": "https://www.youtube.com/watch?v=NVraSWQSINw&list=PL_1f7aI4La-d5OH_9Eqe1fjScE2_xt2mW&index=2",
        "agenda_url": "https://www.cityofventura.ca.gov/AgendaCenter/ViewFile/Agenda/_04152025-3384",
        "minutes_url": "https://www.cityofventura.ca.gov/AgendaCenter/ViewFile/Minutes/_04152025-3384",
        "title": "Finance, Audit & Budget Committee Special Meeting",
        "date": "2025-04-15"
      },
      {
        "meeting_url": "",
        "agenda_url": "https://www.cityofventura.ca.gov/AgendaCenter/ViewFile/Agenda/_07152025-3450",
        "minutes_url": "",
        "title": "General Plan Advisory Committee",
        "date": "2025-07-15"
      },
      {
        "meeting_url": "https://www.youtube.com/watch?v=cR-nQCeY5rs&list=PL_1f7aI4La-eF9ZZGs4ykC3MYC8wE3PKW&index=2",
        "agenda_url": "https://www.cityofventura.ca.gov/AgendaCenter/ViewFile/Agenda/_04302025-3394",
        "minutes_url": "",
        "title": "General Plan Advisory Committee Special Meeting",
        "date": "2025-04-30"
      },
      {
        "meeting_url": "https://www.youtube.com/watch?v=5T5Yq-AEP2Y&list=PL_1f7aI4La-eF9ZZGs4ykC3MYC8wE3PKW&index=3",
        "agenda_url": "https://www.cityofventura.ca.gov/AgendaCenter/ViewFile/Agenda/_01152025-3324",
        "minutes_url": "",
        "title": "General Plan Advisory Committee Meeting",
        "date": "2025-01-15"
      },
      {
        "meeting_url": "https://www.youtube.com/watch?v=gnIeM8C8wMI&list=PL_1f7aI4La-eF9ZZGs4ykC3MYC8wE3PKW&index=4",
        "agenda_url": "https://www.cityofventura.ca.gov/AgendaCenter/ViewFile/Agenda/_01132025-3322",
        "minutes_url": "",
        "title": "General Plan Advisory Committee Meeting",
        "date": "2025-01-13"
      },
      {
        "meeting_url": "https://www.youtube.com/live/3XRJViQtJZ0?si=iJiPFgnk-z-3AykE",
        "agenda_url": "https://www.cityofventura.ca.gov/AgendaCenter/ViewFile/Agenda/_11132025-3527",
        "minutes_url": "",
        "title": "Historic Preservation Committee Meeting",
        "date": "2025-11-13"
      },
      {
        "meeting_url": "https://www.youtube.com/live/PbjrMiK-qgc?si=T3yNJZ9qPczwb96Y",
        "agenda_url": "https://www.cityofventura.ca.gov/AgendaCenter/ViewFile/Agenda/_10092025-3507",
        "minutes_url": "https://www.cityofventura.ca.gov/AgendaCenter/ViewFile/Minutes/_10092025-3507",
        "title": "Historic Preservation Committee Meeting",
        "date": "2025-10-09"
      },
      {
        "meeting_url": "https://www.youtube.com/@cityofventura/streams",
        "agenda_url": "https://www.cityofventura.ca.gov/AgendaCenter/ViewFile/Agenda/_09112025-3485",
        "minutes_url": "https://www.cityofventura.ca.gov/AgendaCenter/ViewFile/Minutes/_09112025-3485",
        "title": "Historic Preservation Committee Meeting",
        "date": "2025-09-11"
      },
      {
        "meeting_url": "",
        "agenda_url": "https://www.cityofventura.ca.gov/AgendaCenter/ViewFile/Agenda/_08142025-3459",
        "minutes_url": "https://www.cityofventura.ca.gov/AgendaCenter/ViewFile/Minutes/_08142025-3459",
        "title": "Historic Preservation Committee Meeting - Cancelled",
        "date": "2025-08-14"
      },
      {
        "meeting_url": "https://www.youtube.com/watch?v=1A5kDFOlQvE&list=PL_1f7aI4La-fvZ01qqWNVhHSlnAhq0mww",
        "agenda_url": "https://www.cityofventura.ca.gov/AgendaCenter/ViewFile/Agenda/_07102025-3444",
        "minutes_url": "https://www.cityofventura.ca.gov/AgendaCenter/ViewFile/Minutes/_07102025-3444",
        "title": "Historic Preservation Committee Meeting",
        "date": "2025-07-10"
      },
      {
        "meeting_url": "https://www.youtube.com/watch?v=I59dYq-PczQ&list=PL_1f7aI4La-fvZ01qqWNVhHSlnAhq0mww&index=2",
        "agenda_url": "https://www.cityofventura.ca.gov/AgendaCenter/ViewFile/Agenda/_06122025-3422",
        "minutes_url": "https://www.cityofventura.ca.gov/AgendaCenter/ViewFile/Minutes/_06122025-3422",
        "title": "Historic Preservation Committee Meeting",
        "date": "2025-06-12"
      },
      {
        "meeting_url": "",
        "agenda_url": "https://www.cityofventura.ca.gov/AgendaCenter/ViewFile/Agenda/_05082025-3392",
        "minutes_url": "",
        "title": "Historic Preservation Committee Meeting - Cancelled",
        "date": "2025-05-08"
      },
      {
        "meeting_url": "https://www.youtube.com/live/8IDp4BYXAlo?si=59zAXLvgcYW-lfwU",
        "agenda_url": "https://www.cityofventura.ca.gov/AgendaCenter/ViewFile/Agenda/_04102025-3380",
        "minutes_url": "https://www.cityofventura.ca.gov/AgendaCenter/ViewFile/Minutes/_04102025-3380",
        "title": "Historic Preservation Committee Agenda",
        "date": "2025-04-10"
      },
      {
        "meeting_url": "https://www.youtube.com/live/geoD5TozyuA?si=fKDa_Hclouw7CeSC",
        "agenda_url": "https://www.cityofventura.ca.gov/AgendaCenter/ViewFile/Agenda/_03132025-3360",
        "minutes_url": "https://www.cityofventura.ca.gov/AgendaCenter/ViewFile/Minutes/_03132025-3360",
        "title": "Historic Preservation Committee Meeting",
        "date": "2025-03-13"
      },
      {
        "meeting_url": "https://www.youtube.com/live/geoD5TozyuA?si=F-XxFWZ7A-12lS3z",
        "agenda_url": "https://www.cityofventura.ca.gov/AgendaCenter/ViewFile/Agenda/_02132025-3346",
        "minutes_url": "https://www.cityofventura.ca.gov/AgendaCenter/ViewFile/Minutes/_02132025-3346",
        "title": "Historic Preservation Committee Meeting",
        "date": "2025-02-13"
      },
      {
        "meeting_url": "https://www.youtube.com/live/CSFCLFMyPmk?si=vRs2eRnXfNMMiN9K",
        "agenda_url": "https://www.cityofventura.ca.gov/AgendaCenter/ViewFile/Agenda/_01092025-3320",
        "minutes_url": "https://www.cityofventura.ca.gov/AgendaCenter/ViewFile/Minutes/_01092025-3320",
        "title": "Historic Preservation Committee Meeting",
        "date": "2025-01-09"
      },
      {
        "meeting_url": "",
        "agenda_url": "https://www.cityofventura.ca.gov/AgendaCenter/ViewFile/Agenda/_11192025-3532",
        "minutes_url": "",
        "title": "Housing & Homelessness Subcommittee",
        "date": "2025-11-19"
      },
      {
        "meeting_url": "",
        "agenda_url": "https://www.cityofventura.ca.gov/AgendaCenter/ViewFile/Agenda/_10292025-3520",
        "minutes_url": "https://www.cityofventura.ca.gov/AgendaCenter/ViewFile/Minutes/_10292025-3520",
        "title": "Housing & Homelessness Subcommittee Special Meeting",
        "date": "2025-10-29"
      },
      {
        "meeting_url": "",
        "agenda_url": "https://www.cityofventura.ca.gov/AgendaCenter/ViewFile/Agenda/_10152025-3509",
        "minutes_url": "",
        "title": "Housing & Homelessness Subcommittee Meeting - CANCELLED",
        "date": "2025-10-15"
      },
      {
        "meeting_url": "https://www.youtube.com/watch?v=w4FS48_IZ6c&list=PL_1f7aI4La-e3apmnUQyN5p7Cl0_0nVq5",
        "agenda_url": "https://www.cityofventura.ca.gov/AgendaCenter/ViewFile/Agenda/_09302025-3501",
        "minutes_url": "https://www.cityofventura.ca.gov/AgendaCenter/ViewFile/Minutes/_09302025-3501",
        "title": "Housing & Homelessness Subcommittee Special Meeting",
        "date": "2025-09-30"
      },
      {
        "meeting_url": "https://www.youtube.com/watch?v=y8_Z5gpvcM8&list=PL_1f7aI4La-e3apmnUQyN5p7Cl0_0nVq5&index=2",
        "agenda_url": "https://www.cityofventura.ca.gov/AgendaCenter/ViewFile/Agenda/_08202025-3474",
        "minutes_url": "https://www.cityofventura.ca.gov/AgendaCenter/ViewFile/Minutes/_08202025-3474",
        "title": "Housing & Homelessness Subcommittee",
        "date": "2025-08-20"
      },
      {
        "meeting_url": "https://www.youtube.com/watch?v=Oj_RfHxIKso&list=PL_1f7aI4La-e3apmnUQyN5p7Cl0_0nVq5",
        "agenda_url": "https://www.cityofventura.ca.gov/AgendaCenter/ViewFile/Agenda/_06182025-3427",
        "minutes_url": "https://www.cityofventura.ca.gov/AgendaCenter/ViewFile/Minutes/_06182025-3427",
        "title": "Housing & Homelessness Subcommittee",
        "date": "2025-06-18"
      },
      {
        "meeting_url": "https://www.youtube.com/watch?v=qwknpZ-jx9E&list=PL_1f7aI4La-e3apmnUQyN5p7Cl0_0nVq5",
        "agenda_url": "https://www.cityofventura.ca.gov/AgendaCenter/ViewFile/Agenda/_05212025-3409",
        "minutes_url": "https://www.cityofventura.ca.gov/AgendaCenter/ViewFile/Minutes/_05212025-3409",
        "title": "Housing & Homelessness Subcommittee",
        "date": "2025-05-21"
      },
      {
        "meeting_url": "https://www.youtube.com/watch?v=pFMkpdgrjcs",
        "agenda_url": "https://www.cityofventura.ca.gov/AgendaCenter/ViewFile/Agenda/_04162025-3383",
        "minutes_url": "https://www.cityofventura.ca.gov/AgendaCenter/ViewFile/Minutes/_04162025-3383",
        "title": "Housing & Homelessness Subcommittee",
        "date": "2025-04-16"
      },
      {
        "meeting_url": "https://www.youtube.com/watch?v=rEnGil3pNls&list=PL_1f7aI4La-e3apmnUQyN5p7Cl0_0nVq5&index=3",
        "agenda_url": "https://www.cityofventura.ca.gov/AgendaCenter/ViewFile/Agenda/_03192025-3367",
        "minutes_url": "https://www.cityofventura.ca.gov/AgendaCenter/ViewFile/Minutes/_03192025-3367",
        "title": "Housing & Homelessness Subcommittee",
        "date": "2025-03-19"
      },
      {
        "meeting_url": "",
        "agenda_url": "https://www.cityofventura.ca.gov/AgendaCenter/ViewFile/Agenda/_02192025-3350",
        "minutes_url": "",
        "title": "Housing & Homelessness Subcommittee - Meeting CANCELLATION",
        "date": "2025-02-19"
      },
      {
        "meeting_url": "https://www.youtube.com/watch?v=hjVog137Vi0&list=PL_1f7aI4La-e3apmnUQyN5p7Cl0_0nVq5&index=4",
        "agenda_url": "https://www.cityofventura.ca.gov/AgendaCenter/ViewFile/Agenda/_01152025-3326",
        "minutes_url": "https://www.cityofventura.ca.gov/AgendaCenter/ViewFile/Minutes/_01152025-3326",
        "title": "Housing & Homelessness Subcommittee",
        "date": "2025-01-15"
      },
      {
        "meeting_url": "",
        "agenda_url": "https://www.cityofventura.ca.gov/AgendaCenter/ViewFile/Agenda/_11032025-3523",
        "minutes_url": "",
        "title": "Measure O Citizens Oversight Committee - Regular Meeting",
        "date": "2025-11-03"
      },
      {
        "meeting_url": "",
        "agenda_url": "https://www.cityofventura.ca.gov/AgendaCenter/ViewFile/Agenda/_08042025-3461",
        "minutes_url": "",
        "title": "CANCELLATION NOTICE - Measure O Citizens Oversight Committee, Regular Meeting on Monday, August 4, 2025",
        "date": "2025-08-04"
      },
      {
        "meeting_url": "https://www.youtube.com/watch?v=GevlXAeWWjI&t=2150s",
        "agenda_url": "https://www.cityofventura.ca.gov/AgendaCenter/ViewFile/Agenda/_05052025-3396",
        "minutes_url": "",
        "title": "Measure O Citizens Oversight Committee - Regular Meeting",
        "date": "2025-05-05"
      },
      {
        "meeting_url": "",
        "agenda_url": "https://www.cityofventura.ca.gov/AgendaCenter/ViewFile/Agenda/_05052025-3408",
        "minutes_url": "",
        "title": "Measure O Citizens Oversight Committee - Supplemental Packet",
        "date": "2025-05-05"
      },
      {
        "meeting_url": "",
        "agenda_url": "https://www.cityofventura.ca.gov/AgendaCenter/ViewFile/Agenda/_02032025-3338",
        "minutes_url": "https://www.cityofventura.ca.gov/AgendaCenter/ViewFile/Minutes/_02032025-3338",
        "title": "Measure O Citizens Oversight Committee - Regular Meeting",
        "date": "2025-02-03"
      },
      {
        "meeting_url": "",
        "agenda_url": "https://www.cityofventura.ca.gov/AgendaCenter/ViewFile/Agenda/_11202025-3535",
        "minutes_url": "",
        "title": "Parking Advisory Committee Regular Meeting for Thursday, November 20, 2025",
        "date": "2025-11-20"
      },
      {
        "meeting_url": "",
        "agenda_url": "https://www.cityofventura.ca.gov/AgendaCenter/ViewFile/Agenda/_10162025-3512",
        "minutes_url": "https://www.cityofventura.ca.gov/AgendaCenter/ViewFile/Minutes/_10162025-3512",
        "title": "Parking Advisory Committee Regular Meeting for Thursday, October 16, 2025",
        "date": "2025-10-16"
      },
      {
        "meeting_url": "",
        "agenda_url": "https://www.cityofventura.ca.gov/AgendaCenter/ViewFile/Agenda/_09182025-3493",
        "minutes_url": "",
        "title": "Parking Advisory Committee Regular Meeting for Thursday, September 18, 2025 CANCELLED",
        "date": "2025-09-18"
      },
      {
        "meeting_url": "",
        "agenda_url": "https://www.cityofventura.ca.gov/AgendaCenter/ViewFile/Agenda/_08212025-3465",
        "minutes_url": "",
        "title": "Parking Advisory Committee Regular Meeting for Thursday, August 21, 2025 CANCELLED",
        "date": "2025-08-21"
      },
      {
        "meeting_url": "",
        "agenda_url": "https://www.cityofventura.ca.gov/AgendaCenter/ViewFile/Agenda/_07172025-3449",
        "minutes_url": "https://www.cityofventura.ca.gov/AgendaCenter/ViewFile/Minutes/_07172025-3449",
        "title": "Parking Advisory Committee Regular Meeting for Thursday, July 17, 2025",
        "date": "2025-07-17"
      },
      {
        "meeting_url": "",
        "agenda_url": "https://www.cityofventura.ca.gov/AgendaCenter/ViewFile/Agenda/_06192025-3430",
        "minutes_url": "",
        "title": "Parking Advisory Committee Regular Meeting for Thursday, June 19, 2025 CANCELLED",
        "date": "2025-06-19"
      },
      {
        "meeting_url": "",
        "agenda_url": "https://www.cityofventura.ca.gov/AgendaCenter/ViewFile/Agenda/_05152025-3403",
        "minutes_url": "https://www.cityofventura.ca.gov/AgendaCenter/ViewFile/Minutes/_05152025-3403",
        "title": "Parking Advisory Committee Regular Meeting for Thursday, May 15, 2025",
        "date": "2025-05-15"
      },
      {
        "meeting_url": "",
        "agenda_url": "https://www.cityofventura.ca.gov/AgendaCenter/ViewFile/Agenda/_04172025-3385",
        "minutes_url": "",
        "title": "Parking Advisory Committee Regular Meeting for Thursday, April17, 2025 CANCELLED",
        "date": "2025-04-17"
      },
      {
        "meeting_url": "",
        "agenda_url": "https://www.cityofventura.ca.gov/AgendaCenter/ViewFile/Agenda/_03202025-3364",
        "minutes_url": "https://www.cityofventura.ca.gov/AgendaCenter/ViewFile/Minutes/_03202025-3364",
        "title": "Parking Advisory Committee Regular Meeting for Thursday, March 20, 2025",
        "date": "2025-03-20"
      },
      {
        "meeting_url": "",
        "agenda_url": "https://www.cityofventura.ca.gov/AgendaCenter/ViewFile/Agenda/_02202025-3348",
        "minutes_url": "https://www.cityofventura.ca.gov/AgendaCenter/ViewFile/Minutes/_02202025-3348",
        "title": "Parking Advisory Committee Regular Meeting for Thursday, February 20, 2025",
        "date": "2025-02-20"
      },
      {
        "meeting_url": "",
        "agenda_url": "https://www.cityofventura.ca.gov/AgendaCenter/ViewFile/Agenda/_01162025-3327",
        "minutes_url": "https://www.cityofventura.ca.gov/AgendaCenter/ViewFile/Minutes/_01162025-3327",
        "title": "Downtown Parking Advisory Committee Regular Meeting for Thursday, January 16, 2025",
        "date": "2025-01-16"
      },
      {
        "meeting_url": "",
        "agenda_url": "https://www.cityofventura.ca.gov/AgendaCenter/ViewFile/Agenda/_11122025-3526",
        "minutes_url": "",
        "title": "Parks and Recreation Commission Regular Meeting (11/12/2025)",
        "date": "2025-11-12"
      },
      {
        "meeting_url": "",
        "agenda_url": "https://www.cityofventura.ca.gov/AgendaCenter/ViewFile/Agenda/_10082025-3503",
        "minutes_url": "https://www.cityofventura.ca.gov/AgendaCenter/ViewFile/Minutes/_10082025-3503",
        "title": "Parks and Recreation Commission Regular Meeting (10/08/2025)",
        "date": "2025-10-08"
      },
      {
        "meeting_url": "",
        "agenda_url": "https://www.cityofventura.ca.gov/AgendaCenter/ViewFile/Agenda/_10082025-3513",
        "minutes_url": "",
        "title": "Parks and Recreation Commission Supplemental Packet (10/8/2025)",
        "date": "2025-10-08"
      },
      {
        "meeting_url": "",
        "agenda_url": "https://www.cityofventura.ca.gov/AgendaCenter/ViewFile/Agenda/_09102025-3487",
        "minutes_url": "https://www.cityofventura.ca.gov/AgendaCenter/ViewFile/Minutes/_09102025-3487",
        "title": "Parks and Recreation Commission Regular Meeting (9/10/2025)",
        "date": "2025-09-10"
      },
      {
        "meeting_url": "",
        "agenda_url": "https://www.cityofventura.ca.gov/AgendaCenter/ViewFile/Agenda/_09102025-3489",
        "minutes_url": "",
        "title": "Parks and Recreation Commission Supplemental Packet (9/10/2025)",
        "date": "2025-09-10"
      },
      {
        "meeting_url": "",
        "agenda_url": "https://www.cityofventura.ca.gov/AgendaCenter/ViewFile/Agenda/_08132025-3455",
        "minutes_url": "",
        "title": "Notice of Cancellation for the Parks and Recreation Commission Meeting scheduled for August 13, 2025",
        "date": "2025-08-13"
      },
      {
        "meeting_url": "",
        "agenda_url": "https://www.cityofventura.ca.gov/AgendaCenter/ViewFile/Agenda/_07092025-3441",
        "minutes_url": "https://www.cityofventura.ca.gov/AgendaCenter/ViewFile/Minutes/_07092025-3441",
        "title": "Parks and Recreation Commission Regular Meeting (7/9/2025)",
        "date": "2025-07-09"
      },
      {
        "meeting_url": "",
        "agenda_url": "https://www.cityofventura.ca.gov/AgendaCenter/ViewFile/Agenda/_06252025-3434",
        "minutes_url": "",
        "title": "Parks and Recreation Commission Special Meeting (06/25/2025)",
        "date": "2025-06-25"
      },
      {
        "meeting_url": "",
        "agenda_url": "https://www.cityofventura.ca.gov/AgendaCenter/ViewFile/Agenda/_06252025-3437",
        "minutes_url": "",
        "title": "Parks and Recreation Commission Supplemental Packet (6/25/2025)",
        "date": "2025-06-25"
      },
      {
        "meeting_url": "",
        "agenda_url": "https://www.cityofventura.ca.gov/AgendaCenter/ViewFile/Agenda/_06112025-3417",
        "minutes_url": "",
        "title": "Notice of Cancellation for the Parks and Recreation Commission Meeting scheduled for June 11, 2025",
        "date": "2025-06-11"
      },
      {
        "meeting_url": "",
        "agenda_url": "https://www.cityofventura.ca.gov/AgendaCenter/ViewFile/Agenda/_05142025-3405",
        "minutes_url": "https://www.cityofventura.ca.gov/AgendaCenter/ViewFile/Minutes/_05142025-3405",
        "title": "Parks and Recreation Commission Regular Meeting (5/14/2025)",
        "date": "2025-05-14"
      },
      {
        "meeting_url": "",
        "agenda_url": "https://www.cityofventura.ca.gov/AgendaCenter/ViewFile/Agenda/_05142025-3413",
        "minutes_url": "",
        "title": "Parks and Recreation Commission Supplemental Packet for 5/14/2025",
        "date": "2025-05-14"
      },
      {
        "meeting_url": "",
        "agenda_url": "https://www.cityofventura.ca.gov/AgendaCenter/ViewFile/Agenda/_04092025-3379",
        "minutes_url": "https://www.cityofventura.ca.gov/AgendaCenter/ViewFile/Minutes/_04092025-3379",
        "title": "Parks and Recreation Commission Regular Meeting (4/09/2025)",
        "date": "2025-04-09"
      },
      {
        "meeting_url": "",
        "agenda_url": "https://www.cityofventura.ca.gov/AgendaCenter/ViewFile/Agenda/_03122025-3359",
        "minutes_url": "https://www.cityofventura.ca.gov/AgendaCenter/ViewFile/Minutes/_03122025-3359",
        "title": "Parks and Recreation Commission Regular Meeting (3/12/2025)",
        "date": "2025-03-12"
      },
      {
        "meeting_url": "",
        "agenda_url": "https://www.cityofventura.ca.gov/AgendaCenter/ViewFile/Agenda/_03122025-3368",
        "minutes_url": "",
        "title": "Parks and Recreation Commission Supplemental Packet for 3/12/2025",
        "date": "2025-03-12"
      },
      {
        "meeting_url": "",
        "agenda_url": "https://www.cityofventura.ca.gov/AgendaCenter/ViewFile/Agenda/_02122025-3342",
        "minutes_url": "https://www.cityofventura.ca.gov/AgendaCenter/ViewFile/Minutes/_02122025-3342",
        "title": "Parks and Recreation Commission Regular Meeting (2/12/2025)",
        "date": "2025-02-12"
      },
      {
        "meeting_url": "",
        "agenda_url": "https://www.cityofventura.ca.gov/AgendaCenter/ViewFile/Agenda/_02122025-3467",
        "minutes_url": "",
        "title": "Parks and Recreation Commission Supplemental Packet for 2-12-2025",
        "date": "2025-02-12"
      },
      {
        "meeting_url": "",
        "agenda_url": "https://www.cityofventura.ca.gov/AgendaCenter/ViewFile/Agenda/_01082025-3318",
        "minutes_url": "https://www.cityofventura.ca.gov/AgendaCenter/ViewFile/Minutes/_01082025-3318",
        "title": "Parks and Recreation Commission Regular Meeting (1/08/2025)",
        "date": "2025-01-08"
      },
      {
        "meeting_url": "",
        "agenda_url": "https://www.cityofventura.ca.gov/AgendaCenter/ViewFile/Agenda/_11192025-3533",
        "minutes_url": "",
        "title": "Planning Commission Agenda",
        "date": "2025-11-19"
      },
      {
        "meeting_url": "",
        "agenda_url": "https://www.cityofventura.ca.gov/AgendaCenter/ViewFile/Agenda/_10222025-3518",
        "minutes_url": "https://www.cityofventura.ca.gov/AgendaCenter/ViewFile/Minutes/_10222025-3518",
        "title": "Planning Commission Meeting",
        "date": "2025-10-22"
      },
      {
        "meeting_url": "",
        "agenda_url": "https://www.cityofventura.ca.gov/AgendaCenter/ViewFile/Agenda/_09252025-3496",
        "minutes_url": "",
        "title": "Planning Commission Special Meeting - Cancelled",
        "date": "2025-09-25"
      },
      {
        "meeting_url": "",
        "agenda_url": "https://www.cityofventura.ca.gov/AgendaCenter/ViewFile/Agenda/_09242025-3499",
        "minutes_url": "https://www.cityofventura.ca.gov/AgendaCenter/ViewFile/Minutes/_09242025-3499",
        "title": "Planning Commission Meeting - General Plan",
        "date": "2025-09-24"
      },
      {
        "meeting_url": "https://www.youtube.com/watch?v=ZPkza7UGkjg",
        "agenda_url": "https://www.cityofventura.ca.gov/AgendaCenter/ViewFile/Agenda/_08272025-3479",
        "minutes_url": "https://www.cityofventura.ca.gov/AgendaCenter/ViewFile/Minutes/_08272025-3479",
        "title": "Planning Commission Meeting",
        "date": "2025-08-27"
      },
      {
        "meeting_url": "https://www.youtube.com/watch?v=mpkbtsDc59s",
        "agenda_url": "https://www.cityofventura.ca.gov/AgendaCenter/ViewFile/Agenda/_07232025-3458",
        "minutes_url": "https://www.cityofventura.ca.gov/AgendaCenter/ViewFile/Minutes/_07232025-3458",
        "title": "Planning Commission Meeting",
        "date": "2025-07-23"
      },
      {
        "meeting_url": "https://www.youtube.com/live/EwcGvZOrmFE?si=eLdnE-4o5tau99bD",
        "agenda_url": "https://www.cityofventura.ca.gov/AgendaCenter/ViewFile/Agenda/_07212025-3457",
        "minutes_url": "https://www.cityofventura.ca.gov/AgendaCenter/ViewFile/Minutes/_07212025-3457",
        "title": "Special Planning Commission Meeting and General Plan EIR Open House",
        "date": "2025-07-21"
      },
      {
        "meeting_url": "",
        "agenda_url": "https://www.cityofventura.ca.gov/AgendaCenter/ViewFile/Agenda/_06252025-3426",
        "minutes_url": "",
        "title": "Planning Commission Meeting - Cancelled",
        "date": "2025-06-25"
      },
      {
        "meeting_url": "https://www.youtube.com/live/nwal_1-Ghbc?si=Edb7T-DYBFaqxZNk",
        "agenda_url": "https://www.cityofventura.ca.gov/AgendaCenter/ViewFile/Agenda/_06172025-3428",
        "minutes_url": "https://www.cityofventura.ca.gov/AgendaCenter/ViewFile/Minutes/_06172025-3428",
        "title": "Planning Commission Special Meeting Agenda",
        "date": "2025-06-17"
      },
      {
        "meeting_url": "https://www.youtube.com/watch?v=PkUqRXY_0Tw&list=PL_1f7aI4La-coJ6A3rAPLXLw5ESUvAO11",
        "agenda_url": "https://www.cityofventura.ca.gov/AgendaCenter/ViewFile/Agenda/_05282025-3415",
        "minutes_url": "https://www.cityofventura.ca.gov/AgendaCenter/ViewFile/Minutes/_05282025-3415",
        "title": "Planning Commission Meeting",
        "date": "2025-05-28"
      },
      {
        "meeting_url": "https://www.youtube.com/watch?v=YAZAXxPXf9Q&list=PL_1f7aI4La-coJ6A3rAPLXLw5ESUvAO11&index=1",
        "agenda_url": "https://www.cityofventura.ca.gov/AgendaCenter/ViewFile/Agenda/_04232025-3388",
        "minutes_url": "https://www.cityofventura.ca.gov/AgendaCenter/ViewFile/Minutes/_04232025-3388",
        "title": "Planning Commission Meeting",
        "date": "2025-04-23"
      },
      {
        "meeting_url": "https://www.youtube.com/watch?v=2SqelqQstcE&list=PL_1f7aI4La-coJ6A3rAPLXLw5ESUvAO11&index=51",
        "agenda_url": "https://www.cityofventura.ca.gov/AgendaCenter/ViewFile/Agenda/_04012025-3374",
        "minutes_url": "https://www.cityofventura.ca.gov/AgendaCenter/ViewFile/Minutes/_04012025-3374",
        "title": "Planning Commission Special Meeting",
        "date": "2025-04-01"
      },
      {
        "meeting_url": "https://www.youtube.com/watch?v=G28_wWvPR2Y",
        "agenda_url": "https://www.cityofventura.ca.gov/AgendaCenter/ViewFile/Agenda/_03262025-3372",
        "minutes_url": "https://www.cityofventura.ca.gov/AgendaCenter/ViewFile/Minutes/_03262025-3372",
        "title": "Planning Commission Meeting",
        "date": "2025-03-26"
      },
      {
        "meeting_url": "https://www.youtube.com/watch?v=R5gMp3lNlWk&list=PL_1f7aI4La-coJ6A3rAPLXLw5ESUvAO11&index=2",
        "agenda_url": "https://www.cityofventura.ca.gov/AgendaCenter/ViewFile/Agenda/_03042025-3356",
        "minutes_url": "https://www.cityofventura.ca.gov/AgendaCenter/ViewFile/Minutes/_03042025-3356",
        "title": "Planning Commission Special Meeting",
        "date": "2025-03-04"
      },
      {
        "meeting_url": "https://www.youtube.com/watch?v=t3H7lQi1MM8&list=PL_1f7aI4La-coJ6A3rAPLXLw5ESUvAO11&index=3",
        "agenda_url": "https://www.cityofventura.ca.gov/AgendaCenter/ViewFile/Agenda/_02262025-3355",
        "minutes_url": "https://www.cityofventura.ca.gov/AgendaCenter/ViewFile/Minutes/_02262025-3355",
        "title": "Planning Commission Meeting",
        "date": "2025-02-26"
      },
      {
        "meeting_url": "https://www.youtube.com/watch?v=gcCBfIQL69s&list=PL_1f7aI4La-coJ6A3rAPLXLw5ESUvAO11&index=4",
        "agenda_url": "https://www.cityofventura.ca.gov/AgendaCenter/ViewFile/Agenda/_01222025-3330",
        "minutes_url": "https://www.cityofventura.ca.gov/AgendaCenter/ViewFile/Minutes/_01222025-3330",
        "title": "Planning Commission Meeting",
        "date": "2025-01-22"
      },
      {
        "meeting_url": "https://www.youtube.com/live/bIogO2D5Vlc?si=8cioXRc0OwpouPvO",
        "agenda_url": "https://www.cityofventura.ca.gov/AgendaCenter/ViewFile/Agenda/_10272025-3521",
        "minutes_url": "",
        "title": "Water Commission Agenda October 27, 2025 Regular Meeting",
        "date": "2025-10-27"
      },
      {
        "meeting_url": "https://www.youtube.com/watch?v=mE5etmfH49U&list=PL_1f7aI4La-fl9iVSCy_BH6nGDm2gBgYQ&index=1",
        "agenda_url": "https://www.cityofventura.ca.gov/AgendaCenter/ViewFile/Agenda/_09222025-3498",
        "minutes_url": "",
        "title": "Water Commission Agenda September 22, 2025 Regular Meeting",
        "date": "2025-09-22"
      },
      {
        "meeting_url": "https://www.youtube.com/watch?v=7BacSOOVw4I&list=PL_1f7aI4La-fl9iVSCy_BH6nGDm2gBgYQ&index=2",
        "agenda_url": "https://www.cityofventura.ca.gov/AgendaCenter/ViewFile/Agenda/_09082025-3486",
        "minutes_url": "",
        "title": "Water Commission Agenda September 8, 2025 Special Meeting",
        "date": "2025-09-08"
      },
      {
        "meeting_url": "https://www.youtube.com/watch?v=gkUVuHD2UK8&list=PL_1f7aI4La-fl9iVSCy_BH6nGDm2gBgYQ&index=3",
        "agenda_url": "https://www.cityofventura.ca.gov/AgendaCenter/ViewFile/Agenda/_08252025-3478",
        "minutes_url": "https://www.cityofventura.ca.gov/AgendaCenter/ViewFile/Minutes/_08252025-3478",
        "title": "Water Commission Agenda August 25, 2025 Regular Meeting",
        "date": "2025-08-25"
      },
      {
        "meeting_url": "https://www.youtube.com/watch?v=8esW956HvxY&list=PL_1f7aI4La-fl9iVSCy_BH6nGDm2gBgYQ",
        "agenda_url": "https://www.cityofventura.ca.gov/AgendaCenter/ViewFile/Agenda/_08072025-3464",
        "minutes_url": "",
        "title": "Water Commission Agenda August 7, 2025 Special Meeting",
        "date": "2025-08-07"
      },
      {
        "meeting_url": "",
        "agenda_url": "https://www.cityofventura.ca.gov/AgendaCenter/ViewFile/Agenda/_07282025-3456",
        "minutes_url": "",
        "title": "Notice of Cancellation of Regular Water Commission Meeting for July 28, 2025",
        "date": "2025-07-28"
      },
      {
        "meeting_url": "https://www.youtube.com/watch?v=TAJenpNZ2aA",
        "agenda_url": "https://www.cityofventura.ca.gov/AgendaCenter/ViewFile/Agenda/_06232025-3431",
        "minutes_url": "https://www.cityofventura.ca.gov/AgendaCenter/ViewFile/Minutes/_06232025-3431",
        "title": "Water Commission Agenda June 23, 2025 Regular Meeting",
        "date": "2025-06-23"
      },
      {
        "meeting_url": "https://www.youtube.com/watch?v=PDZ7nsdKYX0",
        "agenda_url": "https://www.cityofventura.ca.gov/AgendaCenter/ViewFile/Agenda/_05192025-3411",
        "minutes_url": "https://www.cityofventura.ca.gov/AgendaCenter/ViewFile/Minutes/_05192025-3411",
        "title": "Water Commission Agenda May 19, 2025 Regular Meeting",
        "date": "2025-05-19"
      },
      {
        "meeting_url": "https://www.youtube.com/watch?v=QGZzl0Fq7gE&list=PL_1f7aI4La-fl9iVSCy_BH6nGDm2gBgYQ",
        "agenda_url": "https://www.cityofventura.ca.gov/AgendaCenter/ViewFile/Agenda/_04282025-3393",
        "minutes_url": "https://www.cityofventura.ca.gov/AgendaCenter/ViewFile/Minutes/_04282025-3393",
        "title": "Water Commission Agenda April 28, 2025 Regular Meeting",
        "date": "2025-04-28"
      },
      {
        "meeting_url": "https://www.youtube.com/watch?v=jj3LKUgU-XY&list=PL_1f7aI4La-fl9iVSCy_BH6nGDm2gBgYQ",
        "agenda_url": "https://www.cityofventura.ca.gov/AgendaCenter/ViewFile/Agenda/_03242025-3371",
        "minutes_url": "https://www.cityofventura.ca.gov/AgendaCenter/ViewFile/Minutes/_03242025-3371",
        "title": "Water Commission Agenda March 24, 2025 Regular Meeting - Amended 3/24/2025 - Supplemental Packet Posted",
        "date": "2025-03-24"
      },
      {
        "meeting_url": "",
        "agenda_url": "https://www.cityofventura.ca.gov/AgendaCenter/ViewFile/Agenda/_02242025-3351",
        "minutes_url": "",
        "title": "ADVANCED AGENDA ITEM - PSA for Katz and Associates Strategic Communications Planning and Outreach Questionnaire",
        "date": "2025-02-24"
      },
      {
        "meeting_url": "",
        "agenda_url": "https://www.cityofventura.ca.gov/AgendaCenter/ViewFile/Agenda/_02242025-3354",
        "minutes_url": "https://www.cityofventura.ca.gov/AgendaCenter/ViewFile/Minutes/_02242025-3354",
        "title": "Water Commission Agenda February 24, 2025 Regular Meeting - Supplemental Packet Posted",
        "date": "2025-02-24"
      },
      {
        "meeting_url": "",
        "agenda_url": "https://www.cityofventura.ca.gov/AgendaCenter/ViewFile/Agenda/_01272025-3317",
        "minutes_url": "",
        "title": "ADVANCED AGENDA ITEM - 2025 Water and Wastewater Rate Study",
        "date": "2025-01-27"
      },
      {
        "meeting_url": "",
        "agenda_url": "https://www.cityofventura.ca.gov/AgendaCenter/ViewFile/Agenda/_01272025-3335",
        "minutes_url": "https://www.cityofventura.ca.gov/AgendaCenter/ViewFile/Minutes/_01272025-3335",
        "title": "Water Commission Agenda January 27, 2025 Regular Meeting",
        "date": "2025-01-27"
      }
    ]
  },
  {
    "base_url": "https://www.facebook.com/DauphinCountyPA/videos",
    "medias": [
      {
        "meeting_url": "/100064568477099/videos/1497069601513182",
        "agenda_url": "",
        "minutes_url": "",
        "title": "Dauphin County 2026 Budget Hearing 11/13/2025",
        "date": "2025-11-13"
      },
      {
        "meeting_url": "https://www.facebook.com/DauphinCountyPA/videos/dauphin-county-2026-budget-hearing-11132025/1497069601513182/",
        "agenda_url": "",
        "minutes_url": "",
        "title": "Dauphin County 2026 Budget Hearing 11/13/2025",
        "date": "2025-11-13"
      },
      {
        "meeting_url": "https://www.facebook.com/DauphinCountyPA/videos/dauphin-county-commissioners-workshop-meeting-11122025/728567373633436/",
        "agenda_url": "",
        "minutes_url": "",
        "title": "Dauphin County Commissioners' Workshop meeting 11/12/2025",
        "date": "2025-11-12"
      },
      {
        "meeting_url": "https://www.facebook.com/DauphinCountyPA/videos/dauphin-county-prison-town-hall-meeting-11102025/1354658713066657/",
        "agenda_url": "",
        "minutes_url": "",
        "title": "Dauphin County Prison Town Hall meeting 11/10/2025",
        "date": "2025-11-10"
      },
      {
        "meeting_url": "https://www.facebook.com/DauphinCountyPA/videos/dauphin-county-commissioners-legislative-meeting-1152025/2288073781665193/",
        "agenda_url": "",
        "minutes_url": "",
        "title": "Dauphin County Commissioners' Legislative meeting 11/5/2025",
        "date": "2025-11-05"
      },
      {
        "meeting_url": "https://www.facebook.com/DauphinCountyPA/videos/dauphin-county-commissioners-workshop-meeting-10292025/802668019211471/",
        "agenda_url": "",
        "minutes_url": "",
        "title": "Dauphin County Commissioners' Workshop meeting 10/29/2025",
        "date": "2025-10-29"
      }
    ]
  },
  {
    "base_url": "https://www.bethlehem-pa.gov/Calendar",
    "medias": [
      {
        "meeting_url": "",
        "agenda_url": "https://www.bethlehem-pa.gov/getattachment/27494c25-696b-435f-9f3b-76e350c1a27d/COBCalendar_Agenda.aspx ",
        "minutes_url": "",
        "audio_url": "",
        "title": "Public Safety Committee Meeting",
        "date": "2025-10-29"
      },
      {
        "meeting_url": "https://www.youtube.com/watch?v=7wKMH4n6-kY ",
        "agenda_url": "https://www.bethlehem-pa.gov/getattachment/d27fb8f0-93ef-4cf4-a385-1edaa824bd72/COBCalendar_Agenda.aspx ",
        "minutes_url": "",
        "audio_url": "https://www.bethlehem-pa.gov/getattachment/1498ea82-7b57-4079-8bb3-f75fb604d541/COBCalendar_MeetingAudio.aspx ",
        "title": "City Council Meeting - 11/5/2025 7:00:00 PM",
        "date": "2025-11-05"
      },
      {
        "meeting_url": "",
        "agenda_url": "https://www.bethlehem-pa.gov/getattachment/dc3c3656-7b3b-4487-9092-5e4112ab7ff0/COBCalendar_Agenda.aspx ",
        "minutes_url": "",
        "audio_url": "",
        "title": "Budget Meeting (1st)",
        "date": "2025-11-10"
      },
      {
        "meeting_url": "",
        "agenda_url": "https://www.bethlehem-pa.gov/getattachment/4e4ffa51-0bd2-4e54-970f-92549a3daa71/COBCalendar_Agenda.aspx ",
        "minutes_url": "",
        "audio_url": "",
        "title": "Budget Meeting (2nd)",
        "date": "2025-11-12"
      },
      {
        "meeting_url": "",
        "agenda_url": "https://www.bethlehem-pa.gov/getattachment/6288b11a-788a-4cf2-a89d-1e7efc7a018d/COBCalendar_Agenda.aspx ",
        "minutes_url": "",
        "audio_url": "",
        "title": "City Council Meeting - 11/18/2025 7:00:00 PM",
        "date": "2025-11-18"
      },
      {
        "meeting_url": "",
        "agenda_url": "https://www.bethlehem-pa.gov/getattachment/337a0253-1527-46c4-ad5e-53248bf96da9/COBCalendar_Agenda.aspx ",
        "minutes_url": "",
        "audio_url": "",
        "title": "Budget Meeting (3rd)",
        "date": "2025-11-20"
      },
      {
        "meeting_url": "https://www.youtube.com/watch?v=clki1jaJWUg ",
        "agenda_url": "https://www.bethlehem-pa.gov/getattachment/7c3e9384-69cb-468b-9f93-892220e55b72/COBCalendar_Agenda.aspx ",
        "minutes_url": "https://www.bethlehem-pa.gov/getattachment/d5a4fa64-6f46-4e7b-a8ba-f6d75d3f9a85/COBCalendar_MeetingMinutes.aspx ",
        "audio_url": "https://www.bethlehem-pa.gov/getattachment/8e61586e-693f-4086-b109-6c04cd639169/COBCalendar_MeetingAudio.aspx ",
        "title": "City Council Meeting - 10/7/2025 7:00:00 PM",
        "date": "2025-10-07"
      },
      {
        "meeting_url": "",
        "agenda_url": "https://www.bethlehem-pa.gov/getattachment/e47c16e7-b361-4067-9183-d32500800a8e/COBCalendar_Agenda.aspx ",
        "minutes_url": "",
        "audio_url": "",
        "title": "Committee of the Whole Meeting-Amend Article 112 - 10/7/25 6:00 PM",
        "date": "2025-10-07"
      },
      {
        "meeting_url": "https://www.youtube.com/watch?v=pq6uNgiUmgM ",
        "agenda_url": "https://www.bethlehem-pa.gov/getattachment/23e94413-acb4-4c6e-957e-5b6c55918835/COBCalendar_Agenda.aspx ",
        "minutes_url": "https://www.bethlehem-pa.gov/getattachment/95f32d9b-25df-490f-a053-827f14d37734/COBCalendar_MeetingMinutes.aspx ",
        "audio_url": "https://www.bethlehem-pa.gov/getattachment/1e67a6f3-9f73-4cac-9fbd-87d65f50af34/COBCalendar_MeetingAudio.aspx ",
        "title": "City Council Meeting - 10/21/2025 7:00:00 PM",
        "date": "2025-10-21"
      },
      {
        "meeting_url": "",
        "agenda_url": "https://www.bethlehem-pa.gov/getattachment/12412cfd-de3e-4160-918b-a34c572d7eb2/COBCalendar_Agenda.aspx ",
        "minutes_url": "",
        "audio_url": "",
        "title": "Committee of the Whole Meeting-Capital Plan Review",
        "date": "2025-10-21"
      },
      {
        "meeting_url": "https://www.youtube.com/watch?v=t2Z1nhDKHkw ",
        "agenda_url": "https://www.bethlehem-pa.gov/getattachment/8a423cbb-181c-494e-a915-e097e8ede395/COBCalendar_Agenda.aspx ",
        "minutes_url": "https://www.bethlehem-pa.gov/getattachment/140f2009-c9a0-4ff8-ac60-08f8e0ae8b0f/COBCalendar_MeetingMinutes.aspx ",
        "audio_url": "https://www.bethlehem-pa.gov/getattachment/dc0f3a92-9c2b-473d-b6db-0765a1b234ff/COBCalendar_MeetingAudio.aspx ",
        "title": "City Council Meeting - 9/2/2025 7:00:00 PM",
        "date": "2025-09-02"
      },
      {
        "meeting_url": "https://www.youtube.com/watch?v=Ukax13ppv14 ",
        "agenda_url": "https://www.bethlehem-pa.gov/getattachment/55dd4ef0-14ec-4d63-8fbb-f6bbf4163d0d/COBCalendar_Agenda.aspx ",
        "minutes_url": "https://www.bethlehem-pa.gov/getattachment/91bf1b98-55ff-4d09-b118-d7e5b66fd3d3/COBCalendar_MeetingMinutes.aspx ",
        "audio_url": "https://www.bethlehem-pa.gov/getattachment/4ee36d1c-4019-42ee-811e-534b4c4915bf/COBCalendar_MeetingAudio.aspx ",
        "title": "City Council Meeting - 9/16/2025 7:00:00 PM",
        "date": "2025-09-16"
      },
      {
        "meeting_url": "",
        "agenda_url": "https://www.bethlehem-pa.gov/getattachment/2a11c4e1-d79a-4c8d-92e3-505d48f30ebf/COBCalendar_Agenda.aspx ",
        "minutes_url": "",
        "audio_url": "",
        "title": "Finance Committee Meeting 9/16/2025 6:00 PM",
        "date": "2025-09-16"
      },
      {
        "meeting_url": "",
        "agenda_url": "https://www.bethlehem-pa.gov/getattachment/0bfd179d-543b-4f1e-ac35-e3da56bf5ae2/COBCalendar_Agenda.aspx ",
        "minutes_url": "",
        "audio_url": "",
        "title": "POSTPONED - City Council-Pension Board Appeal Hearing - 9/25/2025 6:00:00 PM",
        "date": "2025-09-25"
      },
      {
        "meeting_url": "https://www.youtube.com/watch?v=1Ajy5AU8kq8 ",
        "agenda_url": "https://www.bethlehem-pa.gov/getattachment/d6c8491b-89d5-459e-b092-b7491b164062/COBCalendar_Agenda.aspx ",
        "minutes_url": "https://www.bethlehem-pa.gov/getattachment/8195bc56-5f2d-4ceb-80c2-b5c89bc1ba69/COBCalendar_MeetingMinutes.aspx ",
        "audio_url": "https://www.bethlehem-pa.gov/getattachment/ca41c16e-c05e-4311-9362-77a67bf68f5a/COBCalendar_MeetingAudio.aspx ",
        "title": "City Council Meeting - 8/5/2025",
        "date": "2025-08-05"
      },
      {
        "meeting_url": "",
        "agenda_url": "https://www.bethlehem-pa.gov/getattachment/98efc82d-9170-42bb-9e91-3fca0b2ae8f8/COBCalendar_Agenda.aspx ",
        "minutes_url": "",
        "audio_url": "",
        "title": "POSTPONED - City Council-Pension Board Appeal Hearing - 8/12/2025 6:00:00 PM",
        "date": "2025-08-12"
      },
      {
        "meeting_url": "https://www.youtube.com/watch?v=_cbRvXZBvaI ",
        "agenda_url": "https://www.bethlehem-pa.gov/getattachment/dc3bd12e-4a95-466c-8e88-7ac6d1e4b6e0/COBCalendar_Agenda.aspx ",
        "minutes_url": "https://www.bethlehem-pa.gov/getattachment/b156360d-8c7e-45d6-916a-891733ef7f69/COBCalendar_MeetingMinutes.aspx ",
        "audio_url": "https://www.bethlehem-pa.gov/getattachment/dda2895b-dce7-437b-939a-a4b93cfa6ad1/COBCalendar_MeetingAudio.aspx ",
        "title": "City Council Meeting - 8/19/2025 7:00:00 PM",
        "date": "2025-08-19"
      },
      {
        "meeting_url": "https://www.youtube.com/watch?v=waTJNL0wr-Y ",
        "agenda_url": "https://www.bethlehem-pa.gov/getattachment/dd3c883b-9bcb-49e8-8ded-ca3fbcf0f55b/COBCalendar_Agenda.aspx ",
        "minutes_url": "https://www.bethlehem-pa.gov/getattachment/c2b6bd40-3778-4dd2-94d8-14a75bf34944/COBCalendar_MeetingMinutes.aspx ",
        "audio_url": "https://www.bethlehem-pa.gov/getattachment/2eca8a90-b409-4a1f-9051-f8ab9603cfb3/COBCalendar_MeetingAudio.aspx ",
        "title": "City Council Meeting - 7/1/2025",
        "date": "2025-07-01"
      },
      {
        "meeting_url": "https://www.youtube.com/watch?v=04dCne0VdEc ",
        "agenda_url": "https://www.bethlehem-pa.gov/getattachment/fe7c98e2-18ed-4e5d-b604-36d531fc411e/COBCalendar_Agenda.aspx ",
        "minutes_url": "https://www.bethlehem-pa.gov/getattachment/811a7f01-f5ff-45d5-9a8a-bc50d7ca5c56/COBCalendar_MeetingMinutes.aspx ",
        "audio_url": "https://www.bethlehem-pa.gov/getattachment/80a6d9bf-ba84-463f-9077-a1b64afccfdf/COBCalendar_MeetingAudio.aspx ",
        "title": "City Council Meeting - 7/15/2025",
        "date": "2025-07-15"
      },
      {
        "meeting_url": "",
        "agenda_url": "https://www.bethlehem-pa.gov/getattachment/84a22c43-d7e7-4b6f-bca3-cb825d2dbe9b/COBCalendar_Agenda.aspx ",
        "minutes_url": "",
        "audio_url": "",
        "title": "No title",
        "date": "2025-07-15"
      },
      {
        "meeting_url": "https://www.youtube.com/watch?v=psoSeoZwCck ",
        "agenda_url": "https://www.bethlehem-pa.gov/getattachment/638e035b-f9df-4926-8d77-adf24458d859/COBCalendar_Agenda.aspx ",
        "minutes_url": "https://www.bethlehem-pa.gov/getattachment/c0f08f6f-9282-49d3-aa1f-93c598a8be82/COBCalendar_MeetingMinutes.aspx ",
        "audio_url": "https://www.bethlehem-pa.gov/getattachment/ec21c5d7-1554-4df6-8573-a31ccc2dee3a/COBCalendar_MeetingAudio.aspx ",
        "title": "City Council Meeting - 6/3/2025",
        "date": "2025-06-03"
      },
      {
        "meeting_url": "https://www.youtube.com/@cityofbethlehemcouncil9913/streams ",
        "agenda_url": "https://www.bethlehem-pa.gov/getattachment/209094a4-f03e-499c-a870-837d032de6e2/COBCalendar_Agenda.aspx ",
        "minutes_url": "https://www.bethlehem-pa.gov/getattachment/18173087-f733-467a-aa59-38250b1392be/COBCalendar_MeetingMinutes.aspx ",
        "audio_url": "https://www.bethlehem-pa.gov/getattachment/5088e690-41f9-4dff-8cf0-22ce8794cc43/COBCalendar_MeetingAudio.aspx ",
        "title": "City Council Meeting - 6/17/2025",
        "date": "2025-06-17"
      },
      {
        "meeting_url": "",
        "agenda_url": "https://www.bethlehem-pa.gov/getattachment/410b94d1-f051-4e0f-b945-ef3cfcafa693/COBCalendar_Agenda.aspx ",
        "minutes_url": "",
        "audio_url": "",
        "title": "Community Development Committee 6/17/2025",
        "date": "2025-06-17"
      },
      {
        "meeting_url": "",
        "agenda_url": "https://www.bethlehem-pa.gov/getattachment/00e1aa56-241e-4076-9ae6-8905156bb0ad/COBCalendar_Agenda.aspx ",
        "minutes_url": "",
        "audio_url": "",
        "title": "POSTPONED - City Council-Pension Board Appeal Hearing - 6/24/2025 6:00:00 PM",
        "date": "2025-06-24"
      },
      {
        "meeting_url": "",
        "agenda_url": "https://www.bethlehem-pa.gov/getattachment/71390ef5-79ef-4da6-ba40-9d0d58e3f82c/COBCalendar_Agenda.aspx ",
        "minutes_url": "",
        "audio_url": "",
        "title": "Finance Committee 4/29/2025",
        "date": "2025-04-29"
      },
      {
        "meeting_url": "https://www.youtube.com/watch?v=ahCLI-drC8g ",
        "agenda_url": "https://www.bethlehem-pa.gov/getattachment/7d41e67c-5f43-4cb3-9e11-a19b5a8cda90/COBCalendar_Agenda.aspx ",
        "minutes_url": "https://www.bethlehem-pa.gov/getattachment/e52807e7-088f-44e8-af85-c7b664ab9315/COBCalendar_MeetingMinutes.aspx ",
        "audio_url": "https://www.bethlehem-pa.gov/getattachment/ff357548-ae9f-40a9-b23e-a3521bf9a0a1/COBCalendar_MeetingAudio.aspx ",
        "title": "City Council Meeting - 5/6/2025",
        "date": "2025-05-06"
      },
      {
        "meeting_url": "https://www.youtube.com/watch?v=Fsh_yga1cbE ",
        "agenda_url": "https://www.bethlehem-pa.gov/getattachment/c1a5a229-38b3-445a-a27c-a05a294754a2/COBCalendar_Agenda.aspx ",
        "minutes_url": "https://www.bethlehem-pa.gov/getattachment/396f20cd-7249-4806-9f25-56d352d3f38f/COBCalendar_MeetingMinutes.aspx ",
        "audio_url": "https://www.bethlehem-pa.gov/getattachment/9eea8b8c-a134-4645-ac53-ea9643ed86ab/COBCalendar_MeetingAudio.aspx ",
        "title": "City Council Meeting - 5/21/2025",
        "date": "2025-05-21"
      },
      {
        "meeting_url": "https://www.youtube.com/watch?v=BjMro6_xTHc ",
        "agenda_url": "https://www.bethlehem-pa.gov/getattachment/ee0db507-8865-47fe-89e2-ff366ae2ca43/COBCalendar_Agenda.aspx ",
        "minutes_url": "https://www.bethlehem-pa.gov/getattachment/851a25b1-c418-4a14-8fe1-d20bb16c5aa4/COBCalendar_MeetingMinutes.aspx ",
        "audio_url": "https://www.bethlehem-pa.gov/getattachment/7d9a817e-7a4b-47b9-b4d6-f5d27d183f98/COBCalendar_MeetingAudio.aspx ",
        "title": "No title",
        "date": "2025-04-01"
      },
      {
        "meeting_url": "https://www.youtube.com/watch?v=8cqjqzRNkHw ",
        "agenda_url": "https://www.bethlehem-pa.gov/getattachment/6105a7b3-3b8b-412b-9405-649c9f2fa4fc/COBCalendar_Agenda.aspx ",
        "minutes_url": "https://www.bethlehem-pa.gov/getattachment/ef66adf8-6272-4d19-b4d6-5be1cf15cf6d/COBCalendar_MeetingMinutes.aspx ",
        "audio_url": "https://www.bethlehem-pa.gov/getattachment/98791dcc-08fa-4579-81de-bcacb4c68169/COBCalendar_MeetingAudio.aspx ",
        "title": "City Council Meeting - 4/15/2025",
        "date": "2025-04-15"
      },
      {
        "meeting_url": "",
        "agenda_url": "https://www.bethlehem-pa.gov/getattachment/efeb0b6a-6581-410f-b2ab-2594ec2b092c/COBCalendar_Agenda.aspx ",
        "minutes_url": "",
        "audio_url": "",
        "title": "Finance Committee",
        "date": "2025-02-24"
      },
      {
        "meeting_url": "https://www.youtube.com/watch?v=bJztmR0-qjU ",
        "agenda_url": "https://www.bethlehem-pa.gov/getattachment/12b0a893-694c-4f30-8f9f-ca22ed6c3604/COBCalendar_Agenda.aspx ",
        "minutes_url": "https://www.bethlehem-pa.gov/getattachment/1cd22946-bee2-4c5b-bc92-12abda54437f/COBCalendar_MeetingMinutes.aspx ",
        "audio_url": "https://www.bethlehem-pa.gov/getattachment/fc74acbe-7e30-441f-a666-9114602fbe91/COBCalendar_MeetingAudio.aspx ",
        "title": "City Council Meeting - 3/4/2025",
        "date": "2025-03-04"
      },
      {
        "meeting_url": "",
        "agenda_url": "https://www.bethlehem-pa.gov/getattachment/e84e7576-1335-4cc7-b5f2-2848edb746f8/COBCalendar_Agenda.aspx ",
        "minutes_url": "",
        "audio_url": "",
        "title": "POSTPONED - Community Development Committee 3/4/2025",
        "date": "2025-03-04"
      },
      {
        "meeting_url": "https://www.youtube.com/watch?v=uVL12msdSbk ",
        "agenda_url": "https://www.bethlehem-pa.gov/getattachment/17712604-4905-4940-a3fa-3fc4d0e1e618/COBCalendar_Agenda.aspx ",
        "minutes_url": "https://www.bethlehem-pa.gov/getattachment/7983fde7-1b71-4eec-9c94-4171658f3c12/COBCalendar_MeetingMinutes.aspx ",
        "audio_url": "https://www.bethlehem-pa.gov/getattachment/75ec4ffe-0d35-41fa-bb74-c2e797303edd/COBCalendar_MeetingAudio.aspx ",
        "title": "City Council Meeting - 3/18/2025",
        "date": "2025-03-18"
      },
      {
        "meeting_url": "",
        "agenda_url": "https://www.bethlehem-pa.gov/getattachment/36a086a7-f494-4005-8fe5-79ee8e4eb130/COBCalendar_Agenda.aspx ",
        "minutes_url": "",
        "audio_url": "",
        "title": "Community Development Committee 3/18/2025",
        "date": "2025-03-18"
      },
      {
        "meeting_url": "https://www.youtube.com/watch?v=RUIM06ni4Kw ",
        "agenda_url": "https://www.bethlehem-pa.gov/getattachment/c9a00f5b-c7e6-4f6e-83a0-2547627bc915/COBCalendar_Agenda.aspx ",
        "minutes_url": "https://www.bethlehem-pa.gov/getattachment/e3d3ef12-1274-46cc-b9c6-685f9ad5eee0/COBCalendar_MeetingMinutes.aspx ",
        "audio_url": "https://www.bethlehem-pa.gov/getattachment/487bed88-1d0c-49c8-b143-d4bcbef1840c/COBCalendar_MeetingAudio.aspx ",
        "title": "No title",
        "date": "2025-02-04"
      },
      {
        "meeting_url": "",
        "agenda_url": "https://www.bethlehem-pa.gov/getattachment/054758b1-46f2-4399-9136-eb234a5e4fd5/COBCalendar_Agenda.aspx ",
        "minutes_url": "",
        "audio_url": "",
        "title": "Finance Committee",
        "date": "2025-02-04"
      },
      {
        "meeting_url": "https://www.youtube.com/watch?v=_jCgJXg1ZdA ",
        "agenda_url": "https://www.bethlehem-pa.gov/getattachment/da061741-088c-47cb-a969-4254ca90f5f5/COBCalendar_Agenda.aspx ",
        "minutes_url": "https://www.bethlehem-pa.gov/getattachment/1459bd75-c03e-436d-b52f-2f42b234069a/COBCalendar_MeetingMinutes.aspx ",
        "audio_url": "https://www.bethlehem-pa.gov/getattachment/89eb6149-1435-4e7c-88b1-36aa87b4ebce/COBCalendar_MeetingAudio.aspx ",
        "title": "City Council Meeting - 2/18/2025",
        "date": "2025-02-18"
      },
      {
        "meeting_url": "https://www.youtube.com/watch?v=WmqlnPV31wk ",
        "agenda_url": "https://www.bethlehem-pa.gov/getattachment/809da23a-2441-4651-877b-8a468022cfac/COBCalendar_Agenda.aspx ",
        "minutes_url": "https://www.bethlehem-pa.gov/getattachment/a820da82-de5b-4c74-ad38-bb476d3d21b4/COBCalendar_MeetingMinutes.aspx ",
        "audio_url": "https://www.bethlehem-pa.gov/getattachment/d5278d0b-2b01-492f-aeeb-9d6458703e14/COBCalendar_MeetingAudio.aspx ",
        "title": "No title",
        "date": "2025-01-07"
      },
      {
        "meeting_url": "https://www.youtube.com/watch?v=BIdF1pIxihU ",
        "agenda_url": "https://www.bethlehem-pa.gov/getattachment/d890457d-b705-4aec-87cc-b38b34658517/COBCalendar_Agenda.aspx ",
        "minutes_url": "https://www.bethlehem-pa.gov/getattachment/0723c7ff-c23f-429f-b8cf-8f011535413a/COBCalendar_MeetingMinutes.aspx ",
        "audio_url": "https://www.bethlehem-pa.gov/getattachment/77e11888-4d9e-4183-b164-ccd81578a494/COBCalendar_MeetingAudio.aspx ",
        "title": "City Council Meeting - 1/21/2025",
        "date": "2025-01-21"
      },
      {
        "meeting_url": "",
        "agenda_url": "https://www.bethlehem-pa.gov/getattachment/f61e08e2-df5f-4bb7-8116-e9747cce67ae/COBCalendar_Agenda.aspx ",
        "minutes_url": "",
        "audio_url": "",
        "title": "Budget Meeting (3rd)",
        "date": "2024-11-25"
      },
      {
        "meeting_url": "https://www.youtube.com/watch?v=lk5JsmHwUxk ",
        "agenda_url": "https://www.bethlehem-pa.gov/getattachment/4da116a3-a5a7-489e-9621-abcb4208daff/COBCalendar_Agenda.aspx ",
        "minutes_url": "https://www.bethlehem-pa.gov/getattachment/4da7424c-f0bc-4268-be26-5522948c549a/COBCalendar_MeetingMinutes.aspx ",
        "audio_url": "https://www.bethlehem-pa.gov/getattachment/a60d804d-23a6-4958-83c6-ef975873f942/COBCalendar_MeetingAudio.aspx ",
        "title": "City Council Meeting 12/3/2024",
        "date": "2024-12-03"
      },
      {
        "meeting_url": "",
        "agenda_url": "https://www.bethlehem-pa.gov/getattachment/7ae1edb4-fad4-4805-bb39-44f302e55bf4/COBCalendar_Agenda.aspx ",
        "minutes_url": "",
        "audio_url": "",
        "title": "Finance Committee",
        "date": "2024-12-03"
      },
      {
        "meeting_url": "https://www.youtube.com/watch?v=jZHXlrr9JA4 ",
        "agenda_url": "https://www.bethlehem-pa.gov/getattachment/7dce487f-31a6-4f59-b4f9-9a3b4f5f0721/COBCalendar_Agenda.aspx ",
        "minutes_url": "https://www.bethlehem-pa.gov/getattachment/444a4abe-fc34-4afb-b752-7cd521121858/COBCalendar_MeetingMinutes.aspx ",
        "audio_url": "https://www.bethlehem-pa.gov/getattachment/ba22e863-1d34-4c56-9d0a-0419d972c458/COBCalendar_MeetingAudio.aspx ",
        "title": "City Council Meeting 12/17/2024",
        "date": "2024-12-17"
      }
    ]
  },
  {
    "base_url": "https://go.boarddocs.com/ca/acoe/Board.nsf/Public",
    "medias": [
      {
        "meeting_url": "https://go.boarddocs.com/ca/acoe/Board.nsf/goto?open&id=DMNT2M75469C",
        "agenda_url": "can be downloaded from the meeting_url by a python script",
        "minutes_url": "can be downloaded from the meeting_url by a python script",
        "title": "Regular Board Meeting",
        "date": "2025-11-18"
      },
      {
        "meeting_url": "https://go.boarddocs.com/ca/acoe/Board.nsf/goto?open&id=DMQU477A31A9",
        "agenda_url": "can be downloaded from the meeting_url by a python script",
        "minutes_url": "can be downloaded from the meeting_url by a python script",
        "title": "POLICY & LEGISLATION COMMITTEE MEETING",
        "date": "2025-11-18"
      },
      {
        "meeting_url": "https://go.boarddocs.com/ca/acoe/Board.nsf/goto?open&id=DL7P3E629B68",
        "agenda_url": "can be downloaded from the meeting_url by a python script",
        "minutes_url": "can be downloaded from the meeting_url by a python script",
        "title": "Regular Board Meeting",
        "date": "2025-10-14"
      },
      {
        "meeting_url": "https://go.boarddocs.com/ca/acoe/Board.nsf/goto?open&id=DLFTJW77A8DA",
        "agenda_url": "can be downloaded from the meeting_url by a python script",
        "minutes_url": "can be downloaded from the meeting_url by a python script",
        "title": "BUDGET COMMITTEE MEETING",
        "date": "2025-10-14"
      },
      {
        "meeting_url": "https://go.boarddocs.com/ca/acoe/Board.nsf/goto?open&id=DM2MSP5CACB4",
        "agenda_url": "can be downloaded from the meeting_url by a python script",
        "minutes_url": "can be downloaded from the meeting_url by a python script",
        "title": "POLICY & LEGISLATION COMMITTEE MEETING",
        "date": "2025-10-14"
      },
      {
        "meeting_url": "https://go.boarddocs.com/ca/acoe/Board.nsf/goto?open&id=DL7NJ2601903",
        "agenda_url": "can be downloaded from the meeting_url by a python script",
        "minutes_url": "can be downloaded from the meeting_url by a python script",
        "title": "Regular Board Meeting",
        "date": "2025-09-23"
      },
      {
        "meeting_url": "https://go.boarddocs.com/ca/acoe/Board.nsf/goto?open&id=DJPSTC74351D",
        "agenda_url": "can be downloaded from the meeting_url by a python script",
        "minutes_url": "can be downloaded from the meeting_url by a python script",
        "title": "POLICY & LEGISLATION COMMITTEE MEETING",
        "date": "2025-09-09"
      },
      {
        "meeting_url": "https://go.boarddocs.com/ca/acoe/Board.nsf/goto?open&id=DKALRH57CF94",
        "agenda_url": "can be downloaded from the meeting_url by a python script",
        "minutes_url": "can be downloaded from the meeting_url by a python script",
        "title": "Regular Board Meeting",
        "date": "2025-09-09"
      },
      {
        "meeting_url": "https://go.boarddocs.com/ca/acoe/Board.nsf/goto?open&id=DKWLAW55AB50",
        "agenda_url": "can be downloaded from the meeting_url by a python script",
        "minutes_url": "can be downloaded from the meeting_url by a python script",
        "title": "Special Board Meeting - Interdistrict Transfer Appeals",
        "date": "2025-09-08"
      },
      {
